,Repository_Name,Owner,Description,URL,Programming_Language,Creation_Date,Last_Updated_Date,Number_of_Stars,Number_of_Forks,Number_of_Open_Issues,License_Type
0,matplotlib,matplotlib,matplotlib: plotting with Python,https://github.com/matplotlib/matplotlib,Python,2011-02-19T03:17:12Z,2024-10-06T02:05:05Z,20072,7598,1597,
1,matplotlib-cpp,lava,Extremely simple yet powerful header-only C++ plotting library built on the popular matplotlib,https://github.com/lava/matplotlib-cpp,C++,2014-10-08T10:48:27Z,2024-10-05T10:48:01Z,4378,1133,221,MIT License
2,matplotlib-tutorial,rougier,Matplotlib tutorial for beginner,https://github.com/rougier/matplotlib-tutorial,Python,2013-05-12T07:22:19Z,2024-10-06T10:14:41Z,2941,807,7,
3,cheatsheets,matplotlib,Official Matplotlib cheat sheets,https://github.com/matplotlib/cheatsheets,Python,2020-05-05T15:50:03Z,2024-10-05T21:49:48Z,7339,883,22,"BSD 2-Clause ""Simplified"" License"
4,matplotlib-cheatsheet,rougier,Matplotlib 3.1 cheat sheet. ,https://github.com/rougier/matplotlib-cheatsheet,Python,2019-08-11T15:24:54Z,2024-10-03T18:17:56Z,2897,402,1,"BSD 2-Clause ""Simplified"" License"
5,SciencePlots,garrettj403,Matplotlib styles for scientific plotting,https://github.com/garrettj403/SciencePlots,Python,2018-08-13T16:23:03Z,2024-10-06T09:49:48Z,7045,709,5,MIT License
6,AnatomyOfMatplotlib,matplotlib,Anatomy of Matplotlib -- tutorial developed for the SciPy conference,https://github.com/matplotlib/AnatomyOfMatplotlib,Jupyter Notebook,2013-06-26T19:58:50Z,2024-09-19T07:24:37Z,1212,598,5,Other
7,matplotlib-gallery,rasbt,Examples of matplotlib codes and plots,https://github.com/rasbt/matplotlib-gallery,Jupyter Notebook,2014-01-24T04:13:52Z,2024-10-05T22:30:07Z,1185,302,1,GNU General Public License v3.0
8,matplotlib_for_papers,jbmouret,"Handout for the tutorial ""Creating publication-quality figures with matplotlib""",https://github.com/jbmouret/matplotlib_for_papers,Jupyter Notebook,2014-08-02T19:42:48Z,2024-09-27T22:11:34Z,2128,298,1,Other
9,matplotlib_tutorial,KeithGalli,Source code to go along with my tutorial to learn data visualization with the matplotlib library of Python,https://github.com/KeithGalli/matplotlib_tutorial,Jupyter Notebook,2019-05-31T19:28:57Z,2024-10-03T18:44:54Z,321,454,0,
10,ipympl,matplotlib,Matplotlib Jupyter Integration,https://github.com/matplotlib/ipympl,TypeScript,2016-07-21T14:38:56Z,2024-10-06T11:07:40Z,1568,227,155,"BSD 3-Clause ""New"" or ""Revised"" License"
11,mplfinance,matplotlib,Financial Markets Data Visualization using Matplotlib,https://github.com/matplotlib/mplfinance,Python,2019-12-05T16:32:32Z,2024-10-06T06:26:23Z,3615,624,164,Other
12,matplotlib-cn,teadocs,matplotlib中文文档,https://github.com/teadocs/matplotlib-cn,JavaScript,2018-10-03T01:06:11Z,2024-09-25T16:47:22Z,534,209,17,
13,matplotlib,derekbanas,This is the cheat sheet Jupyter Notebook I made for my Matplotlib Learn in One Video Tutorial. I basically condensed the Matplotlib API down into this one cheat sheet with tons of examples.,https://github.com/derekbanas/matplotlib,Jupyter Notebook,2020-08-22T16:35:11Z,2024-09-26T09:48:40Z,101,97,0,
14,fantastic-matplotlib,datawhalechina,Matplotlib中文教程，在线阅读地址：https://datawhalechina.github.io/fantastic-matplotlib/,https://github.com/datawhalechina/fantastic-matplotlib,Python,2020-12-07T05:07:47Z,2024-09-29T09:13:01Z,456,105,1,Other
15,scientific-visualization-book,rougier,An open access book on scientific visualization using python and matplotlib,https://github.com/rougier/scientific-visualization-book,Python,2019-08-16T08:51:32Z,2024-10-06T14:12:16Z,10669,986,18,Other
16,prettyplotlib,olgabot,Painlessly create beautiful matplotlib plots.,https://github.com/olgabot/prettyplotlib,Python,2013-07-18T14:39:58Z,2024-09-25T10:41:22Z,1691,148,11,MIT License
17,python_for_data_analysis_2nd_chinese_version,iamseancheney,《利用Python进行数据分析·第2版》,https://github.com/iamseancheney/python_for_data_analysis_2nd_chinese_version,,2018-06-22T02:29:56Z,2024-10-06T15:03:53Z,7824,2671,15,
18,11_Python_Matplotlib_Module,milaan9,"Matplotlib is an amazing visualization library in Python for 2D plots of arrays. Matplotlib is a multi-platform data visualization library built on NumPy arrays and designed to work with the broader SciPy stack. It was introduced by John Hunter in the year 2002. One of the greatest benefits of visualization is that it allows us visual access to huge amounts of data in easily digestible visuals. Matplotlib consists of several plots like line, bar, scatter, histogram, etc",https://github.com/milaan9/11_Python_Matplotlib_Module,Jupyter Notebook,2021-06-15T03:54:29Z,2024-09-29T07:31:23Z,219,207,0,MIT License
19,matplotlib4j,sh0nk,"Matplotlib for java: A simple graph plot library for java, scala and kotlin with powerful python matplotlib",https://github.com/sh0nk/matplotlib4j,Java,2017-09-25T14:53:46Z,2024-09-26T03:29:35Z,227,36,22,MIT License
20,matplotlib-venn,konstantint,Area-weighted venn-diagrams for Python/matplotlib,https://github.com/konstantint/matplotlib-venn,Jupyter Notebook,2012-10-11T23:39:46Z,2024-09-29T06:36:06Z,508,68,4,MIT License
21,cartopy,SciTools,Cartopy - a cartographic python library with matplotlib support,https://github.com/SciTools/cartopy,Python,2012-08-03T07:43:59Z,2024-10-06T02:05:06Z,1415,361,320,"BSD 3-Clause ""New"" or ""Revised"" License"
22,MatplotlibCS,ITGlobal,A tiny utility for utilizing Matplotlib Python charting library from C#.,https://github.com/ITGlobal/MatplotlibCS,C#,2016-09-11T11:26:31Z,2024-09-05T19:01:23Z,93,39,7,MIT License
23,matplotlib-doc-zh,apachecn,:book: [译] Matplotlib 用户指南,https://github.com/apachecn/matplotlib-doc-zh,CSS,2017-01-07T12:10:43Z,2024-04-28T04:06:34Z,191,115,0,Other
24,mplcyberpunk,dhaitz,"""Cyberpunk style"" for matplotlib plots",https://github.com/dhaitz/mplcyberpunk,Python,2020-03-29T17:22:58Z,2024-10-04T07:06:27Z,1673,70,15,MIT License
25,bar_chart_race,dexplo,Create animated bar chart races in Python with matplotlib,https://github.com/dexplo/bar_chart_race,Python,2020-04-27T05:21:00Z,2024-10-01T13:14:12Z,1352,351,48,MIT License
26,mplstereonet,joferkington,Stereonets for matplotlib,https://github.com/joferkington/mplstereonet,Python,2012-04-13T17:16:28Z,2024-09-14T12:29:10Z,188,65,25,MIT License
27,daft,daft-dev,Render probabilistic graphical models using matplotlib,https://github.com/daft-dev/daft,Python,2012-09-21T16:10:12Z,2024-10-05T14:40:19Z,675,118,19,MIT License
28,gif,maxhumber,The matplotlib Animation Extension,https://github.com/maxhumber/gif,Python,2020-01-30T03:06:06Z,2024-10-01T16:36:13Z,662,49,0,MIT License
29,Pandas_Numpy_Matplotlib_Plotly,sksalahuddin2828,Explore something new,https://github.com/sksalahuddin2828/Pandas_Numpy_Matplotlib_Plotly,Python,2023-05-14T19:56:31Z,2024-08-09T09:53:20Z,169,96,0,
30,Matplotlib-3.0-Cookbook,PacktPublishing,"Matplotlib 3.0 Cookbook, published by Packt",https://github.com/PacktPublishing/Matplotlib-3.0-Cookbook,Jupyter Notebook,2018-10-19T07:45:25Z,2024-09-18T12:53:09Z,130,104,1,MIT License
31,Vegas,vegas-viz,The missing MatPlotLib for Scala + Spark,https://github.com/vegas-viz/Vegas,Scala,2016-04-14T16:44:32Z,2024-09-01T21:17:45Z,730,98,54,MIT License
32,pySankey,anazalea,create sankey diagrams with matplotlib,https://github.com/anazalea/pySankey,Jupyter Notebook,2016-10-24T23:29:40Z,2024-10-05T20:35:21Z,251,95,33,GNU General Public License v3.0
33,qbstyles,mckinsey,QuantumBlack Matplotlib styles,https://github.com/mckinsey/qbstyles,Jupyter Notebook,2019-02-07T16:22:29Z,2024-09-30T09:19:02Z,358,37,13,Other
34,oreilly-matplotlib-course,croach,"Jupyter notebooks from my O'Reilly Media course ""Matplolib for Developers: Data Visualization and Analysis with Python""",https://github.com/croach/oreilly-matplotlib-course,Jupyter Notebook,2015-10-15T19:07:54Z,2024-06-13T19:00:17Z,137,68,2,MIT License
35,PythonDataScienceHandbook,jakevdp,Python Data Science Handbook: full text in Jupyter Notebooks,https://github.com/jakevdp/PythonDataScienceHandbook,Jupyter Notebook,2016-08-10T14:24:36Z,2024-10-06T14:05:49Z,42882,17853,211,MIT License
36,garden.matplotlib,kivy-garden,Matplotlib backends using kivy,https://github.com/kivy-garden/garden.matplotlib,Python,2015-08-19T21:26:48Z,2024-07-02T12:58:08Z,103,50,30,MIT License
37,basemap,matplotlib,Plot on map projections (with coastlines and political boundaries) using matplotlib,https://github.com/matplotlib/basemap,Python,2011-02-19T02:58:42Z,2024-10-03T16:01:15Z,776,392,112,MIT License
38,intro_matplotlib_python,InoveAlumnos,Material de clase y ejercicios acerca de Matplotlib,https://github.com/InoveAlumnos/intro_matplotlib_python,Python,2021-04-23T00:08:25Z,2024-08-23T23:11:17Z,6,210,0,
39,pyband,QijingZheng,band plot using python matplotlib,https://github.com/QijingZheng/pyband,Python,2017-04-05T03:12:01Z,2024-09-19T08:45:06Z,151,90,21,
40,UpSetPlot,jnothman,Draw UpSet plots with Matplotlib,https://github.com/jnothman/UpSetPlot,Python,2018-02-21T12:23:00Z,2024-10-04T19:02:45Z,323,63,45,Other
41,mplsoccer,andrewRowlinson,Football pitch plotting library for matplotlib,https://github.com/andrewRowlinson/mplsoccer,Python,2019-06-01T04:35:23Z,2024-10-06T12:24:13Z,402,81,22,MIT License
42,cmaps,hhuangwx,user defined colormaps in matplotlib.,https://github.com/hhuangwx/cmaps,Jupyter Notebook,2016-05-30T01:41:25Z,2024-10-06T05:24:07Z,225,72,3,GNU General Public License v3.0
43,japanize-matplotlib,uehara1414,install & import するだけで matplotlib を日本語表示対応させる,https://github.com/uehara1414/japanize-matplotlib,Python,2018-10-07T11:12:33Z,2024-09-30T01:12:22Z,178,33,9,MIT License
44,matplotlib-3d,rougier,Experimental 3D axis for matplotlib,https://github.com/rougier/matplotlib-3d,Python,2020-03-26T11:31:05Z,2024-09-11T17:55:53Z,268,35,1,"BSD 2-Clause ""Simplified"" License"
45,PyPlot.jl,JuliaPy,Plotting for Julia based on matplotlib.pyplot,https://github.com/JuliaPy/PyPlot.jl,Julia,2012-11-21T01:42:21Z,2024-10-03T16:36:17Z,476,87,114,MIT License
46,celluloid,jwkvam,:movie_camera: Matplotlib animations made easy,https://github.com/jwkvam/celluloid,Python,2018-11-17T02:53:47Z,2024-09-10T14:59:53Z,1122,42,21,MIT License
47,matplotlib-label-lines,cphyc,Label line using matplotlib.,https://github.com/cphyc/matplotlib-label-lines,Jupyter Notebook,2017-03-13T09:13:08Z,2024-10-05T19:12:00Z,297,29,11,MIT License
48,matplotblog,matplotlib,Matplotlib blog,https://github.com/matplotlib/matplotblog,Jupyter Notebook,2019-08-02T02:53:55Z,2022-06-13T12:35:02Z,35,39,2,
49,python4ScientificComputing_Numpy_Pandas_MATPLotLIB,bnajafi,"python4ScientificComputing, Numpy, Pandas and Matplotlib",https://github.com/bnajafi/python4ScientificComputing_Numpy_Pandas_MATPLotLIB,Jupyter Notebook,2017-01-19T05:06:37Z,2023-12-22T15:25:09Z,46,97,2,
50,matplotlib-scalebar,ppinard,"Provides a new artist for matplotlib to display a scale bar, aka micron bar.",https://github.com/ppinard/matplotlib-scalebar,Python,2015-12-29T20:12:43Z,2024-09-04T19:13:15Z,145,27,17,"BSD 2-Clause ""Simplified"" License"
51,python-ternary,marcharper,:small_red_triangle: Ternary plotting library for python with matplotlib,https://github.com/marcharper/python-ternary,Python,2012-08-07T23:48:55Z,2024-09-19T00:40:26Z,726,156,36,MIT License
52,mpld3,mpld3,An interactive data visualization tool which brings matplotlib graphics to the browser using D3.,https://github.com/mpld3/mpld3,Jupyter Notebook,2013-12-18T01:48:30Z,2024-10-01T19:20:42Z,2352,359,217,"BSD 3-Clause ""New"" or ""Revised"" License"
53,seaborn,mwaskom,Statistical data visualization in Python,https://github.com/mwaskom/seaborn,Python,2012-06-18T18:41:19Z,2024-10-06T13:16:06Z,12459,1916,178,"BSD 3-Clause ""New"" or ""Revised"" License"
54,brokenaxes,bendichter,Create matplotlib plots with broken axes,https://github.com/bendichter/brokenaxes,Python,2017-04-12T16:37:16Z,2024-09-30T10:20:26Z,518,46,13,MIT License
55,aquarel,lgienapp,Styling matplotlib made easy,https://github.com/lgienapp/aquarel,Python,2022-08-07T08:42:41Z,2024-10-02T14:00:32Z,719,19,5,MIT License
56,matplotlib-feedstock,conda-forge,A conda-smithy repository for matplotlib.,https://github.com/conda-forge/matplotlib-feedstock,Batchfile,2016-01-10T08:01:48Z,2024-09-12T18:10:03Z,22,57,2,"BSD 3-Clause ""New"" or ""Revised"" License"
57,mpltools,tonysyu,Tools for Matplotlib,https://github.com/tonysyu/mpltools,Python,2012-02-13T05:46:09Z,2024-04-23T04:55:38Z,125,28,7,Other
58,tikzplotlib,nschloe,:bar_chart: Save matplotlib figures as TikZ/PGFplots for smooth integration into LaTeX.,https://github.com/nschloe/tikzplotlib,Python,2010-01-14T21:44:27Z,2024-10-03T12:37:53Z,2397,214,135,MIT License
59,matplotlibcpp17,soblin,"Alternative to matplotlibcpp with better syntax, based on pybind",https://github.com/soblin/matplotlibcpp17,C++,2022-02-04T02:25:57Z,2024-08-27T06:14:47Z,73,13,4,MIT License
60,matplotlib-stylesheets,dhaitz,Stylesheets for Matplotlib,https://github.com/dhaitz/matplotlib-stylesheets,,2020-07-01T09:05:18Z,2024-09-22T20:40:51Z,286,18,1,MIT License
61,lab-matplotlib-seaborn,ta-data-lis,,https://github.com/ta-data-lis/lab-matplotlib-seaborn,Jupyter Notebook,2019-08-28T15:12:27Z,2024-04-06T20:55:48Z,2,192,34,
62,matplotlib4papers,amarasovic,Matplotlib examples to present results.,https://github.com/amarasovic/matplotlib4papers,Jupyter Notebook,2017-12-19T16:31:24Z,2024-01-04T16:19:28Z,70,13,0,
63,matplotlibPyQt5,boxcontrol,Embedding matplotlib plot on PyQt5 GUI!,https://github.com/boxcontrol/matplotlibPyQt5,Python,2015-02-13T09:18:34Z,2024-03-05T11:51:20Z,44,19,1,
64,vapeplot,dantaki,matplotlib extension for vaporwave aesthetics,https://github.com/dantaki/vapeplot,Python,2018-01-25T19:21:33Z,2024-09-25T23:47:33Z,577,24,0,GNU General Public License v2.0
65,tensorflow-plot,wookayin,📈 TensorFlow + Matplotlib as TF ops,https://github.com/wookayin/tensorflow-plot,Python,2017-03-26T01:11:48Z,2024-01-04T16:12:39Z,298,43,5,MIT License
66,DataViz,DataForScience,Data Visualization With Matplotlib and Seaborn,https://github.com/DataForScience/DataViz,Jupyter Notebook,2019-06-02T21:18:59Z,2024-09-29T15:04:26Z,101,69,0,MIT License
67,mpl-finance,matplotlib,"This package is DEPRECATED, replaced by https://github.com/matplotlib/mplfinance",https://github.com/matplotlib/mpl-finance,Python,2016-09-08T07:56:04Z,2024-09-30T19:48:27Z,308,201,5,Other
68,matplotlib.github.com,matplotlib,,https://github.com/matplotlib/matplotlib.github.com,HTML,2011-02-19T03:27:35Z,2024-08-20T08:11:32Z,24,54,3,
69,matplotlib_pydata2013,jakevdp,PyData SV 2013 Tutorial on Advanced Matplotlib,https://github.com/jakevdp/matplotlib_pydata2013,Python,2013-03-14T23:20:54Z,2023-06-23T14:30:45Z,57,35,0,
70,storytelling-with-data,empathy87,"Plots from the book ""Storytelling with data"" implementation using Python and matplotlib",https://github.com/empathy87/storytelling-with-data,Jupyter Notebook,2018-08-25T12:15:18Z,2024-10-05T04:06:37Z,322,132,4,
71,The-Data-Wrangling-Workshop,PacktWorkshops,"pandas, numpy, matplotlib, data-wrangling",https://github.com/PacktWorkshops/The-Data-Wrangling-Workshop,Jupyter Notebook,2020-02-25T05:47:40Z,2024-08-26T13:21:57Z,25,92,12,MIT License
72,visualization_matplotlib_project,commit-live-students,,https://github.com/commit-live-students/visualization_matplotlib_project,Jupyter Notebook,2017-09-28T06:07:56Z,2022-01-31T05:01:48Z,1,196,180,
73,chaquopy-matplotlib,chaquo,Chaquopy Matplotlib example,https://github.com/chaquo/chaquopy-matplotlib,Kotlin,2020-12-05T15:46:19Z,2024-10-04T11:13:05Z,69,25,0,MIT License
74,matplotlib-winbuild,jbmohler,,https://github.com/jbmohler/matplotlib-winbuild,Python,2013-12-05T15:50:15Z,2024-02-25T05:06:25Z,42,31,6,The Unlicense
75,Matplotlib,yang-jinchao,matplotlib 绘图可视化知识点,https://github.com/yang-jinchao/Matplotlib,HTML,2018-06-07T03:44:20Z,2024-09-04T10:46:53Z,56,15,0,
76,patchworklib,ponnhide,"Patchwork for matplotlib: A subplot manager for intuitive layouts in matplotlib, seaborn, and plotnine.",https://github.com/ponnhide/patchworklib,Jupyter Notebook,2021-11-06T20:04:59Z,2024-10-03T02:37:52Z,372,25,9,GNU General Public License v3.0
77,proplot,proplot-dev,"🎨 A succinct matplotlib wrapper for making beautiful, publication-quality graphics",https://github.com/proplot-dev/proplot,Python,2017-12-06T09:07:18Z,2024-10-03T15:03:17Z,1110,102,91,MIT License
78,Pyto,ColdGrub1384,"Python IDE for iOS with NumPy, Matplotlib, Pandas, SciPy and SciKit-Learn",https://github.com/ColdGrub1384/Pyto,C++,2018-09-15T22:29:07Z,2024-09-24T11:54:45Z,892,151,93,MIT License
79,data-visualization,gboeing,"Misc data visualization projects, examples, and demos: mostly Python (pandas + matplotlib) and JavaScript (leaflet).",https://github.com/gboeing/data-visualization,Jupyter Notebook,2014-08-31T08:48:09Z,2024-10-01T13:11:44Z,735,308,4,
80,Basic-Well-Log-Interpretation,petroGG,"Basic Well Log Interpretation with python, pandas, matplotlib",https://github.com/petroGG/Basic-Well-Log-Interpretation,Lasso,2016-03-25T11:02:35Z,2024-09-26T03:05:10Z,133,91,0,GNU General Public License v3.0
81,data-science-ipython-notebooks,donnemartin,"Data science Python notebooks: Deep learning (TensorFlow, Theano, Caffe, Keras), scikit-learn, Kaggle, big data (Spark, Hadoop MapReduce, HDFS), matplotlib, pandas, NumPy, SciPy, Python essentials, AWS, and various command lines.",https://github.com/donnemartin/data-science-ipython-notebooks,Python,2015-01-23T19:38:29Z,2024-10-06T13:45:57Z,27252,7848,39,Other
82,matplotlib-chord-diagram,fengwangPhysics,plot chord diagram with matplotlib,https://github.com/fengwangPhysics/matplotlib-chord-diagram,Python,2017-12-31T10:07:48Z,2024-08-23T02:20:50Z,81,25,6,MIT License
83,prettymaps,marceloprates,"A small set of Python functions to draw pretty maps from OpenStreetMap data. Based on osmnx, matplotlib and shapely libraries.",https://github.com/marceloprates/prettymaps,Jupyter Notebook,2021-03-05T12:22:05Z,2024-10-06T05:22:27Z,11122,522,63,GNU Affero General Public License v3.0
84,tf-matplotlib,cheind,Seamlessly integrate matplotlib figures as tensorflow summaries.,https://github.com/cheind/tf-matplotlib,Python,2018-03-22T13:45:15Z,2023-06-04T06:27:46Z,119,17,2,MIT License
85,rose-pine-matplotlib,h4pZ,"All natural pine, faux fur and a bit of soho vibes for the classy minimalist",https://github.com/h4pZ/rose-pine-matplotlib,,2021-05-02T00:06:53Z,2024-09-08T12:14:12Z,304,14,0,MIT License
86,pyqt5-matplotlib-tushare-,qq1162667214,用tushare获取股票历史行情，以及实时行情，并用matplotlib嵌入pyqt5中，达到数据可视化，可操作的目的,https://github.com/qq1162667214/pyqt5-matplotlib-tushare-,Python,2017-06-02T02:20:34Z,2024-09-17T08:21:58Z,52,37,0,
87,notes-python,lijin-THU,中文 Python 笔记,https://github.com/lijin-THU/notes-python,Jupyter Notebook,2015-10-08T09:30:56Z,2024-09-29T15:38:28Z,6930,2905,11,
88,pyheat,csurfer,pprofile + matplotlib = Python program profiled as an awesome heatmap!,https://github.com/csurfer/pyheat,Python,2017-02-04T22:56:02Z,2024-08-18T18:12:43Z,829,46,8,MIT License
89,pySmithPlot,vMeijin,Matplotlib extension for creating Smith charts with Python,https://github.com/vMeijin/pySmithPlot,Python,2013-05-13T16:56:48Z,2024-07-26T07:39:38Z,127,73,19,
90,scientific_python_cheat_sheet,IPGP,"simple overview of python, numpy, scipy, matplotlib functions that are useful for scientific work",https://github.com/IPGP/scientific_python_cheat_sheet,HTML,2016-02-17T21:26:45Z,2024-09-16T16:28:18Z,579,224,5,Creative Commons Attribution 4.0 International
91,python-matplotlib-practices,weidafeng,《Python数据可视化之matplotlib实践》配套代码。,https://github.com/weidafeng/python-matplotlib-practices,Jupyter Notebook,2019-12-28T13:46:08Z,2024-08-27T13:40:04Z,58,25,0,
92,Cycloidal-Drive-Animation,Tomato1107,Based on matplotlib,https://github.com/Tomato1107/Cycloidal-Drive-Animation,Python,2020-09-23T01:36:54Z,2024-08-07T19:45:38Z,54,21,1,MIT License
93,matplotlib-backend-kitty,jktr,show matplotlib plots directly in your kitty terminal,https://github.com/jktr/matplotlib-backend-kitty,Python,2019-12-04T21:32:56Z,2024-09-21T12:27:31Z,138,16,4,Creative Commons Zero v1.0 Universal
94,matplotlib-4-abaqus,Solid-Mechanics,allow abaqus(v6.14-1) to use matplotlib in its build-in python scripts environment.,https://github.com/Solid-Mechanics/matplotlib-4-abaqus,Python,2015-03-18T23:17:04Z,2024-07-11T05:36:57Z,43,26,3,MIT License
95,Data-Visualization-using-Matplotlib,BadreeshShetty,Matplotlib Visualizations,https://github.com/BadreeshShetty/Data-Visualization-using-Matplotlib,Jupyter Notebook,2018-11-13T05:07:43Z,2024-07-29T04:28:09Z,22,23,0,
96,joypy,leotac,Joyplots in Python with matplotlib & pandas :chart_with_upwards_trend:,https://github.com/leotac/joypy,Jupyter Notebook,2017-07-30T17:18:50Z,2024-10-04T10:43:24Z,558,59,18,MIT License
97,windmap,rougier,Streamlines animation (matplotlib),https://github.com/rougier/windmap,Python,2018-01-02T20:04:00Z,2024-07-18T14:07:13Z,59,19,0,"BSD 2-Clause ""Simplified"" License"
98,napari-matplotlib,matplotlib,Linking napari layers with Matplotlib plots,https://github.com/matplotlib/napari-matplotlib,Python,2022-04-29T12:15:42Z,2024-10-01T11:35:58Z,38,21,15,"BSD 3-Clause ""New"" or ""Revised"" License"
99,mplleaflet,jwass,Easily convert matplotlib plots from Python into interactive Leaflet web maps.,https://github.com/jwass/mplleaflet,Python,2014-05-04T16:01:48Z,2024-07-18T15:29:58Z,522,76,48,"BSD 3-Clause ""New"" or ""Revised"" License"
100,matplotlib-inline,ipython,Inline Matplotlib backend for Jupyter,https://github.com/ipython/matplotlib-inline,Jupyter Notebook,2021-02-11T16:43:31Z,2024-07-18T04:29:59Z,19,29,13,"BSD 3-Clause ""New"" or ""Revised"" License"
101,matplotx,nschloe,:bar_chart: More styles and useful extensions for Matplotlib,https://github.com/nschloe/matplotx,Python,2021-10-24T14:54:58Z,2024-10-02T06:01:17Z,789,35,9,MIT License
102,ScipySuperpack,fonnesbeck,"Recent builds of Numpy, Scipy, Matplotlib, iPython and PyMC for OSX",https://github.com/fonnesbeck/ScipySuperpack,Shell,2011-11-30T22:41:21Z,2024-08-08T02:06:46Z,490,75,1,Other
103,dsc-more-practice-with-matplotlib-lab,learn-co-curriculum,,https://github.com/learn-co-curriculum/dsc-more-practice-with-matplotlib-lab,Jupyter Notebook,2019-02-19T10:09:44Z,2024-07-11T15:40:21Z,2,200,0,Other
104,cheatsheets-ai,kailashahirwar,Essential Cheat Sheets for deep learning and machine learning researchers https://medium.com/@kailashahirwar/essential-cheat-sheets-for-machine-learning-and-deep-learning-researchers-efb6a8ebd2e5,https://github.com/kailashahirwar/cheatsheets-ai,,2017-05-24T12:06:56Z,2024-10-05T21:42:48Z,15085,3443,9,MIT License
105,Animations-with-Matplotlib,parulnith,Using the matplotlib library to create some interesting animations.,https://github.com/parulnith/Animations-with-Matplotlib,Jupyter Notebook,2019-04-13T14:13:48Z,2024-03-30T15:08:18Z,44,22,0,
106,wxmplot,newville,wxPython plotting widgets using matplotlib,https://github.com/newville/wxmplot,Python,2011-11-16T17:00:02Z,2024-09-06T11:42:57Z,76,26,2,MIT License
107,animatplot,t-makaro,A python package for animating plots build on matplotlib.,https://github.com/t-makaro/animatplot,Python,2017-04-03T00:54:04Z,2024-09-18T13:35:01Z,410,38,17,MIT License
108,Numpy-Pandas-Matplotlib-Tutorial,veb-101,"Tutorial notebooks on numpy, pandas and matplotlib. ",https://github.com/veb-101/Numpy-Pandas-Matplotlib-Tutorial,Jupyter Notebook,2019-12-21T16:56:39Z,2024-08-09T03:22:56Z,36,30,0,The Unlicense
109,interactive_tutorial,matplotlib,Interactive Matplotlib tutorial,https://github.com/matplotlib/interactive_tutorial,Python,2016-10-07T16:24:56Z,2024-09-11T18:18:44Z,29,21,1,
110,dsc-more-practice-with-matplotlib,learn-co-curriculum,,https://github.com/learn-co-curriculum/dsc-more-practice-with-matplotlib,Jupyter Notebook,2019-02-25T09:19:37Z,2024-07-11T15:40:03Z,1,185,0,Other
111,mpl-scatter-density,astrofrog,:zap: Fast scatter density plots for Matplotlib :zap:,https://github.com/astrofrog/mpl-scatter-density,Python,2011-09-13T21:31:28Z,2024-09-23T14:59:15Z,498,25,21,"BSD 2-Clause ""Simplified"" License"
112,matplotlib-haskell,abarbu,Haskell bindings for Python's Matplotlib,https://github.com/abarbu/matplotlib-haskell,Haskell,2017-03-06T08:19:18Z,2024-08-13T16:52:39Z,85,12,8,Other
113,geojsoncontour,bartromgens,Convert matplotlib contour plots to geojson,https://github.com/bartromgens/geojsoncontour,Python,2016-05-01T23:25:34Z,2024-06-17T20:42:22Z,90,29,4,MIT License
114,Colormap_MATLAB,kunyiwang,Quick transfer packages from Python matplotlib to MATLAB,https://github.com/kunyiwang/Colormap_MATLAB,Python,2023-11-01T20:37:53Z,2024-09-23T15:26:46Z,167,40,0,
115,matplotlib-curly-brace,iruletheworld,Plot curly brace with matplotlib,https://github.com/iruletheworld/matplotlib-curly-brace,HTML,2019-04-21T22:41:51Z,2024-08-15T22:35:53Z,45,20,6,MIT License
116,voila,binder-examples,Using Voilà with matplotlib example,https://github.com/binder-examples/voila,Jupyter Notebook,2019-06-06T12:44:51Z,2024-01-09T15:57:03Z,12,70,0,"BSD 3-Clause ""New"" or ""Revised"" License"
117,matplotlibrc,daler,"some example matplotlibrc files, and a script display their effects",https://github.com/daler/matplotlibrc,Python,2013-06-30T17:34:55Z,2024-08-12T19:11:59Z,48,12,0,
118,lab-matplotlib-seaborn,ta-data-bcn,,https://github.com/ta-data-bcn/lab-matplotlib-seaborn,Jupyter Notebook,2019-03-26T07:53:50Z,2019-10-09T10:43:15Z,0,94,64,
119,nbashots,savvastj,"NBA shot charts using matplotlib, seaborn, and bokeh.",https://github.com/savvastj/nbashots,Jupyter Notebook,2015-12-22T20:09:05Z,2024-09-09T16:41:51Z,164,35,5,"BSD 3-Clause ""New"" or ""Revised"" License"
120,data-visualization,thepycoach,Data visualization in Python with Matplotlib & Seaborn,https://github.com/thepycoach/data-visualization,Jupyter Notebook,2020-11-07T14:32:19Z,2024-07-03T12:23:07Z,40,49,1,
