,Repository_Name,Owner,Description,URL,Programming_Language,Creation_Date,Last_Updated_Date,Number_of_Stars,Number_of_Forks,Number_of_Open_Issues,License_Type
364,lab-matplotlib-seaborn,Ironhack-Data-Madrid-Enero-2022,,https://github.com/Ironhack-Data-Madrid-Enero-2022/lab-matplotlib-seaborn,Jupyter Notebook,2022-01-17T19:21:48Z,2022-01-17T19:22:19Z,0,14,14,
365,ds-skills-matplotlib-nyc-ds-091018,learn-co-students,,https://github.com/learn-co-students/ds-skills-matplotlib-nyc-ds-091018,Jupyter Notebook,2018-09-17T21:30:38Z,2018-09-17T21:30:48Z,0,21,0,
366,matplotlib_iterm2,oselivanov,External matplotlib backend uses iTerm2 inline image display feature.,https://github.com/oselivanov/matplotlib_iterm2,Python,2015-05-04T04:40:24Z,2023-03-22T09:48:25Z,34,3,3,MIT License
367,Matplotlib_animation,leeroee,Matplotlib保存K-means聚类过程为gif动画,https://github.com/leeroee/Matplotlib_animation,Python,2019-09-17T13:59:45Z,2023-10-10T07:00:32Z,5,6,0,
368,pythonplot.com,tdhopper,"📈 Interactive comparison of Python plotting libraries for exploratory data analysis. Examples of using Pandas plotting, plotnine, Seaborn, and Matplotlib.",https://github.com/tdhopper/pythonplot.com,Jupyter Notebook,2017-06-14T21:34:15Z,2024-09-11T03:17:19Z,107,38,1,Other
369,mlnote,chokkan,機械学習帳,https://github.com/chokkan/mlnote,Jupyter Notebook,2021-09-29T12:18:53Z,2024-09-17T07:02:20Z,341,27,4,
370,backtrader_plotly,lamkashingpaul,Plot backtrader's result using plotly instead of the matplotlib,https://github.com/lamkashingpaul/backtrader_plotly,Python,2021-11-28T14:54:12Z,2024-09-07T15:36:43Z,42,9,0,GNU General Public License v3.0
371,Demo_Matplotlib_Python,ShaShiDiZhuanLan,python3绘制折线图、柱形图、饼图、三维散点图、散点图,https://github.com/ShaShiDiZhuanLan/Demo_Matplotlib_Python,Python,2019-12-12T01:54:43Z,2024-05-29T00:11:19Z,17,4,0,
372,scalaplot,sameersingh,"Library to plot graphs using a scala frontend, and various backends such as gnuplot, jfreegraph, matplotlib, etc.",https://github.com/sameersingh/scalaplot,Scala,2012-06-06T21:29:47Z,2024-03-18T12:05:55Z,123,20,10,"BSD 2-Clause ""Simplified"" License"
373,Matplotlib,guenchi,Matplotlib for Chez Scheme,https://github.com/guenchi/Matplotlib,Scheme,2019-01-15T01:11:42Z,2023-07-11T19:05:54Z,26,2,1,MIT License
374,MassSpectraPlot,matrixx567,Plotting mass spectra with Matplotlib,https://github.com/matrixx567/MassSpectraPlot,Python,2015-07-11T19:39:05Z,2024-03-13T05:30:47Z,31,4,1,MIT License
375,ds-skills-matplotlib-pivot-nyc-ds-091018,learn-co-students,,https://github.com/learn-co-students/ds-skills-matplotlib-pivot-nyc-ds-091018,Jupyter Notebook,2018-09-19T21:29:30Z,2018-09-19T21:29:36Z,0,23,0,
376,matplotlib-tools,terranjp,Various tools for matplotlib.,https://github.com/terranjp/matplotlib-tools,Python,2017-04-09T12:42:09Z,2024-04-29T23:49:30Z,7,5,1,
377,mexican-government-report,PhantomInsights,"Text Mining on the 2019 Mexican Government Report, covering from extracting text from a PDF file to plotting the results.",https://github.com/PhantomInsights/mexican-government-report,Python,2019-09-10T10:42:52Z,2024-05-29T09:09:23Z,482,87,0,MIT License
378,flask-matplotlib-tutorial,cerickson,Hopefully this will walk you through integrating semi-dynamic matplotlib charts in a small flask app.  ,https://github.com/cerickson/flask-matplotlib-tutorial,Python,2018-02-06T02:46:02Z,2024-08-06T11:45:28Z,16,4,0,MIT License
379,matplotlib,shreekanta1,,https://github.com/shreekanta1/matplotlib,Jupyter Notebook,2020-08-26T02:19:54Z,2020-08-26T02:26:04Z,0,8,0,MIT License
380,Data-Science-for-Marketing-Analytics,TrainingByPackt,Achieve your marketing goals with the data analytics power of Python,https://github.com/TrainingByPackt/Data-Science-for-Marketing-Analytics,Jupyter Notebook,2018-10-24T09:51:14Z,2024-10-04T11:41:16Z,208,129,1,MIT License
381,mpl-point-clicker,mpl-extensions,A multiclass point clicker for matplotlib,https://github.com/mpl-extensions/mpl-point-clicker,Python,2021-06-30T20:01:15Z,2024-07-17T10:24:19Z,17,6,3,"BSD 3-Clause ""New"" or ""Revised"" License"
382,Working-with-matplotlib-and-Django,JohnKiguru,,https://github.com/JohnKiguru/Working-with-matplotlib-and-Django,JavaScript,2021-10-19T21:07:26Z,2023-11-19T13:46:20Z,11,6,0,
383,pyimagevideo,scivision,"write animated GIF, multipage append TIFF, AVI OGV video in Python",https://github.com/scivision/pyimagevideo,Python,2015-02-13T05:27:12Z,2023-08-16T17:55:27Z,39,17,0,Apache License 2.0
384,ds-skills-matplotlib-nyc-ds-100218,learn-co-students,,https://github.com/learn-co-students/ds-skills-matplotlib-nyc-ds-100218,Jupyter Notebook,2018-10-05T20:51:58Z,2018-10-05T20:52:10Z,0,19,0,
385,PlotIt,NITDgpOS,A terminal and GUI based tool to visualise mathematical functions.,https://github.com/NITDgpOS/PlotIt,Python,2017-10-11T20:04:52Z,2024-04-04T11:37:11Z,14,26,23,MIT License
386,LiveFFTPitchTracker,flothesof,"[DEPRECATED] matplotlib, pyaudio based live waveform recorder + FFT app",https://github.com/flothesof/LiveFFTPitchTracker,Jupyter Notebook,2015-07-20T14:24:05Z,2021-08-12T06:10:19Z,17,10,0,"BSD 2-Clause ""Simplified"" License"
387,NotebookWithLibs,mosalov,"Empty Jupyter Notebook with numpy, pandas and matplotlib",https://github.com/mosalov/NotebookWithLibs,Jupyter Notebook,2020-03-01T08:42:28Z,2020-03-02T11:20:54Z,0,28,0,MIT License
388,matplotlib-rs,mneumann,Uses rust-cpython to provide a convenient interface to Python's matplotlib from Rust,https://github.com/mneumann/matplotlib-rs,Rust,2015-12-31T12:12:26Z,2024-04-29T08:26:24Z,20,4,0,MIT License
389,matplot-well-log,g2boojum,Simple well log plotting using Python and matplotlib,https://github.com/g2boojum/matplot-well-log,Python,2017-01-10T15:46:49Z,2024-03-15T12:56:17Z,25,7,0,MIT License
390,50_matplotlib,xinranli-coder,Top 50 matplotlib Visualizations from:,https://github.com/xinranli-coder/50_matplotlib,,2020-03-05T07:14:11Z,2020-03-05T07:14:14Z,0,11,0,
391,data-viz,lkuffo,"Más de 50 ejemplos de visualizaciones y análisis de datos en Matplotlib, Pandas, Seaborn, Plotly, Bokeh y Networkx",https://github.com/lkuffo/data-viz,Jupyter Notebook,2023-01-28T21:14:30Z,2024-10-03T07:43:22Z,44,32,0,GNU General Public License v3.0
392,tftb,scikit-signal,A Python module for time-frequency analysis,https://github.com/scikit-signal/tftb,Python,2014-10-10T13:40:21Z,2024-10-04T14:27:45Z,261,56,30,
393,SciPlot-PyQt,CCampJr,A Matplotlib-wrapped user-interface for creating and editing publication-ready images and plots,https://github.com/CCampJr/SciPlot-PyQt,Python,2016-07-07T16:17:01Z,2024-08-12T15:45:05Z,50,15,5,Other
394,matplotlib-d,koji-kojiro,,https://github.com/koji-kojiro/matplotlib-d,D,2016-12-18T20:52:51Z,2021-09-21T14:31:11Z,10,5,9,MIT License
395,matplotlib-terminal,matrach,Matplotlib backend to plot in terminal using matrach/img2unicode,https://github.com/matrach/matplotlib-terminal,Python,2020-05-07T12:13:21Z,2024-06-22T12:07:11Z,51,3,2,MIT License
396,Matplotlib-for-Python-Developers,PacktPublishing,"Matplotlib for Python Developers [Video], Published by Packt",https://github.com/PacktPublishing/Matplotlib-for-Python-Developers,,2019-04-18T10:40:33Z,2024-05-31T17:25:43Z,5,7,0,MIT License
397,Matplotlib_tutorial,manjusv,Matplotlib tutorial based on video tutorial by Corey Schafer -  https://bit.ly/2L7xsot,https://github.com/manjusv/Matplotlib_tutorial,Python,2019-07-09T07:11:20Z,2023-10-01T12:14:32Z,6,6,0,
398,grid-strategy,matplotlib,Library to facilitate the arrangement of matplotlib subplots based on the number of plots,https://github.com/matplotlib/grid-strategy,Python,2019-02-23T05:34:22Z,2024-08-22T08:51:01Z,41,16,16,Apache License 2.0
399,ds-matplotlib-intro-lab-nyc-ds-career-031119,learn-co-students,,https://github.com/learn-co-students/ds-matplotlib-intro-lab-nyc-ds-career-031119,Jupyter Notebook,2019-03-14T13:14:12Z,2019-03-14T13:14:21Z,0,23,0,
400,lab-matplotlib-seaborn,ta-data-remote,,https://github.com/ta-data-remote/lab-matplotlib-seaborn,Jupyter Notebook,2021-03-23T09:44:59Z,2021-07-01T09:47:09Z,0,12,17,
401,display_matplotlib,lsst,afwDisplay using matplotlib as a backend,https://github.com/lsst/display_matplotlib,Python,2017-08-21T18:48:21Z,2024-05-21T07:11:26Z,2,8,0,
402,matplotlibsampler,datademofun,Datasets and Matplotlib/pandas examples,https://github.com/datademofun/matplotlibsampler,Jupyter Notebook,2016-05-02T11:56:15Z,2022-01-03T21:33:16Z,7,4,0,
403,mplopengl,karlwessel,OpenGL based backend for matplotlib,https://github.com/karlwessel/mplopengl,Python,2019-02-04T08:40:21Z,2024-09-11T02:35:00Z,14,5,14,MIT License
404,Python-B-spline-examples,kawache,"Examples in Python about plotting and interpolating a B-spline curve and their comparison using Numpy, Scipy and Matplotlib.",https://github.com/kawache/Python-B-spline-examples,Python,2015-10-10T10:17:30Z,2024-09-30T07:33:48Z,105,25,0,MIT License
405,serialplot,crxguy52,A python GUI that plots serial data in real time. Used with embedded systems. Uses matplotlib and pyserial,https://github.com/crxguy52/serialplot,Python,2016-04-14T17:36:16Z,2024-09-29T07:19:42Z,74,24,5,
406,lab-matplotlib-seaborn,Ironhack-Data-BCN-July-2022,,https://github.com/Ironhack-Data-BCN-July-2022/lab-matplotlib-seaborn,Jupyter Notebook,2022-06-04T14:27:58Z,2022-06-04T14:28:32Z,0,12,11,
407,matplotlib,zziz,Matplotlib Tutorial. No comments. Just code.,https://github.com/zziz/matplotlib,Jupyter Notebook,2018-08-19T06:55:15Z,2023-03-11T12:29:03Z,8,3,1,
408,make-a-gif-map-in-python,bendoesdata,"Tutorial notebook showing how to make a gif map in Python using Geopandas, Matplotlib and ImageMagick",https://github.com/bendoesdata/make-a-gif-map-in-python,Jupyter Notebook,2018-10-08T14:45:27Z,2024-01-27T23:34:43Z,28,26,1,
409,lab-matplotlib-seaborn,Ironhack-data-bcn-january-2023,,https://github.com/Ironhack-data-bcn-january-2023/lab-matplotlib-seaborn,Jupyter Notebook,2023-01-10T17:30:33Z,2023-01-10T17:30:40Z,0,12,2,
410,python-tutorials,padas-pub,"Tutorials about python language basics, numpy, scipy, pandas and matplotlib.",https://github.com/padas-pub/python-tutorials,Jupyter Notebook,2018-11-15T09:01:16Z,2024-04-25T01:47:21Z,20,10,1,
411,matplottery,aminnj,Histogram plotting with matplotlib,https://github.com/aminnj/matplottery,Python,2018-03-10T23:10:05Z,2020-03-10T08:43:19Z,9,5,0,
412,knitron,fhirschmann,[DEPRECATED] Use IPython and matplotlib in knitr!,https://github.com/fhirschmann/knitron,R,2015-01-18T22:22:01Z,2023-01-04T13:58:31Z,29,5,5,
413,custom_colormap,CSlocumWX,Generate custom colormaps for matplotlib,https://github.com/CSlocumWX/custom_colormap,Python,2018-03-07T21:32:10Z,2024-03-25T17:21:17Z,13,5,0,"BSD 3-Clause ""New"" or ""Revised"" License"
414,sci-plot-example,yangmqglobe,A simple framework for generating academic publication-ready figures directly using Matplotlib.,https://github.com/yangmqglobe/sci-plot-example,Jupyter Notebook,2023-05-28T02:48:27Z,2024-09-11T06:58:42Z,56,9,0,
415,5.2-lab-matplotlib-seaborn,Ironhack-Data-Madrid-Marzo-2022,,https://github.com/Ironhack-Data-Madrid-Marzo-2022/5.2-lab-matplotlib-seaborn,Jupyter Notebook,2022-04-18T08:59:52Z,2022-04-19T13:40:12Z,0,14,11,
416,Day8-Lab1-Matplotlib,RawabeT,,https://github.com/RawabeT/Day8-Lab1-Matplotlib,Jupyter Notebook,2022-11-01T11:35:41Z,2022-11-01T12:15:46Z,0,15,0,
417,calfem-python,CALFEM,CALFEM for Python is the Python port of the CALFEM finite element toolkit. It also implements meshing function based on GMSH and triangle. Visualisation routines are implemented using visvis and matplotlib.,https://github.com/CALFEM/calfem-python,Python,2015-11-01T23:57:12Z,2024-09-30T03:07:08Z,114,189,6,MIT License
418,waterfall_ax,microsoft,Create waterfall charts with matplotlib,https://github.com/microsoft/waterfall_ax,Python,2020-10-03T04:44:30Z,2023-08-24T14:07:55Z,6,7,0,MIT License
419,Python-Visual-Vocabulary,ZJsnowman,Python 实现常见的50个可视化作品,https://github.com/ZJsnowman/Python-Visual-Vocabulary,Jupyter Notebook,2019-02-25T10:49:53Z,2024-08-06T06:23:51Z,51,12,0,
420,Matplotlib_in_Real_Time_to_Plot_Webpage_Loading_Time,cyx441984694,Matplotlib_in_Real_Time_Plotting_Using_Ion,https://github.com/cyx441984694/Matplotlib_in_Real_Time_to_Plot_Webpage_Loading_Time,Python,2018-09-13T11:48:57Z,2021-07-22T05:22:39Z,6,10,0,
421,ds-matplotlib-intro-readme-nyc-ds-career-031119,learn-co-students,,https://github.com/learn-co-students/ds-matplotlib-intro-readme-nyc-ds-career-031119,Jupyter Notebook,2019-03-14T13:13:47Z,2019-03-14T13:13:58Z,0,22,0,
422,Introducci-n-a-Numpy-Pandas-Matplotlib,alfonsocude,,https://github.com/alfonsocude/Introducci-n-a-Numpy-Pandas-Matplotlib,Jupyter Notebook,2021-04-27T04:34:29Z,2021-04-29T19:57:27Z,0,16,0,
423,Loan-prediction-using-Machine-Learning-and-Python,Architectshwet,"To design a predictive model using xgboost and voting ensembling techniques and extract insights from the data using pandas, seaborn and matplotlib",https://github.com/Architectshwet/Loan-prediction-using-Machine-Learning-and-Python,Jupyter Notebook,2018-05-26T16:11:26Z,2024-10-04T16:47:43Z,38,63,2,
424,Jupyter-Tutoriais,arnaldog12,"Jupyter Notebooks com tutorias sobre python, numpy, pandas e matplotlib",https://github.com/arnaldog12/Jupyter-Tutoriais,Jupyter Notebook,2017-05-18T13:23:44Z,2024-09-18T21:08:44Z,24,10,0,
425,Day8-Lab2-Matplotlib,shahadd9,,https://github.com/shahadd9/Day8-Lab2-Matplotlib,Jupyter Notebook,2022-11-01T13:24:54Z,2022-11-01T14:07:03Z,0,15,0,
426,simple-back,MiniXC,A simple daily python backtester that works out of the box.,https://github.com/MiniXC/simple-back,Python,2020-05-19T10:29:11Z,2024-05-20T19:16:10Z,59,12,17,Mozilla Public License 2.0
427,belajar_matplotlib,boedybios,,https://github.com/boedybios/belajar_matplotlib,Jupyter Notebook,2020-09-14T10:49:14Z,2024-02-10T02:41:15Z,5,6,0,
428,python-datascience,faizanbashir,"Docker image for python datascience container with NumPy, SciPy, Scikit-learn, Matplotlib, nltk, pandas packages installed.",https://github.com/faizanbashir/python-datascience,Dockerfile,2019-01-15T03:12:23Z,2023-11-09T08:14:45Z,48,18,3,MIT License
429,PERTgen,vamsi-aribandi,Python code to generate a PERT graph and Gantt chart given a task schedule,https://github.com/vamsi-aribandi/PERTgen,Python,2018-02-22T09:09:34Z,2024-05-24T14:27:10Z,18,10,1,MIT License
430,dsc-0-03-131-customizing-matplotlib-online-ds-pt-100118,learn-co-students,,https://github.com/learn-co-students/dsc-0-03-131-customizing-matplotlib-online-ds-pt-100118,Jupyter Notebook,2018-10-06T17:02:30Z,2018-10-06T17:02:36Z,0,28,1,Other
431,canvas,mdipierro,canvas is a simple interface to most common matplotlib functions,https://github.com/mdipierro/canvas,Python,2012-06-02T21:14:55Z,2024-04-17T21:08:05Z,42,7,3,
432,matplotlib-py3,mdboom,,https://github.com/mdboom/matplotlib-py3,Python,2011-02-22T16:59:31Z,2023-01-28T21:30:00Z,3,7,0,Other
433,wellArchitectureDesign,fraclad,Leveraging matplotlib to visualize well drilling and construction,https://github.com/fraclad/wellArchitectureDesign,Python,2022-01-14T07:07:35Z,2024-10-02T10:41:54Z,19,7,0,MIT License
434,daltonize,joergdietrich,Simulate and correct images for dichromatic color blindness,https://github.com/joergdietrich/daltonize,Python,2015-01-30T11:55:59Z,2024-09-10T13:46:40Z,81,18,1,GNU General Public License v2.0
435,numpy-intro-blogarticle-2020,rasbt,"Jupyter Notebook for the ""Scientific Computing in Python: Introduction to NumPy and Matplotlib"" blog article",https://github.com/rasbt/numpy-intro-blogarticle-2020,Jupyter Notebook,2020-09-27T22:44:55Z,2024-09-29T15:25:57Z,45,16,0,MIT License
436,ggGenshin,RestlessTail,Genshin palettes for ggplot2 and Matplotlib,https://github.com/RestlessTail/ggGenshin,R,2023-03-12T05:08:39Z,2024-09-24T05:32:15Z,30,4,0,GNU General Public License v3.0
437,Mastering-Matplotlib-2.x,PacktPublishing,"Mastering Matplotlib 2.x, published by Packt",https://github.com/PacktPublishing/Mastering-Matplotlib-2.x,Jupyter Notebook,2018-11-29T07:42:33Z,2024-02-10T22:00:02Z,4,7,0,MIT License
438,fMRI_data_analysis,akcarsten,Python code explaining how to display structural and functional fMRI data.,https://github.com/akcarsten/fMRI_data_analysis,Jupyter Notebook,2018-11-28T21:23:18Z,2024-10-02T12:11:07Z,93,33,1,MIT License
439,beads,magi-1,Audio visualizer using matplotlib,https://github.com/magi-1/beads,Jupyter Notebook,2019-12-26T02:59:33Z,2021-12-10T11:07:02Z,25,3,0,
440,ds-matplotlib-intro-lab-nyc-ds-career-012819,learn-co-students,,https://github.com/learn-co-students/ds-matplotlib-intro-lab-nyc-ds-career-012819,Jupyter Notebook,2019-02-04T15:53:34Z,2019-02-04T15:53:42Z,0,21,0,
441,asciiplot,mfouesneau,"Package that allows you to plot simple graphs in ASCII, a la matplotlib",https://github.com/mfouesneau/asciiplot,Python,2014-02-06T23:57:21Z,2024-07-18T15:08:05Z,73,9,1,
442,alluvial_diagram,vinsburg,"A python  script for generating ""alluvial"" styled bipartite diagrams, using matplotlib and numpy",https://github.com/vinsburg/alluvial_diagram,Python,2018-01-16T12:18:30Z,2024-07-10T10:29:58Z,47,11,3,GNU General Public License v3.0
443,python-controlchart,torstenfeld,Creation of control charts with matplotlib,https://github.com/torstenfeld/python-controlchart,Python,2015-10-06T13:51:15Z,2023-01-10T13:52:30Z,11,6,3,MIT License
444,mpl-animators,sunpy,Interactive animations with matplotlib,https://github.com/sunpy/mpl-animators,Python,2021-10-20T14:52:51Z,2024-09-30T13:28:22Z,5,6,7,"BSD 3-Clause ""New"" or ""Revised"" License"
445,xkcd-Style-Plots,Doometnick,Create matplotlib plots with the art style of Randall Munroe's xkcd,https://github.com/Doometnick/xkcd-Style-Plots,Python,2019-10-20T09:35:14Z,2024-10-01T16:24:42Z,85,7,0,MIT License
446,Zhihu-Spider,moranzcw,一个获取知乎用户主页信息的多线程Python爬虫程序。,https://github.com/moranzcw/Zhihu-Spider,Python,2017-05-13T14:46:14Z,2024-05-07T17:56:17Z,137,50,4,MIT License
447,CMC,LinShanify,A Tool for Ploting CMC Curve,https://github.com/LinShanify/CMC,Python,2017-11-21T06:34:37Z,2024-01-16T13:12:55Z,24,8,2,
448,lab-matplotlib-seaborn,Ironhack-Data-Madrid-Agosto-2021,,https://github.com/Ironhack-Data-Madrid-Agosto-2021/lab-matplotlib-seaborn,Jupyter Notebook,2021-08-16T13:36:31Z,2021-08-19T13:42:47Z,0,11,1,
449,flights-analysis,Hugoch,A quick script for flight data visualisation using matplotlib,https://github.com/Hugoch/flights-analysis,Python,2015-10-19T21:14:39Z,2024-04-21T11:26:28Z,25,7,0,MIT License
450,ds-skills-matplotlib-pivot-nyc-ds-100218,learn-co-students,,https://github.com/learn-co-students/ds-skills-matplotlib-pivot-nyc-ds-100218,Jupyter Notebook,2018-10-05T20:51:57Z,2018-10-05T20:52:03Z,0,18,0,
451,Day8-Lab1-Matplotlib,SalehDS-Tuwaiq,,https://github.com/SalehDS-Tuwaiq/Day8-Lab1-Matplotlib,Jupyter Notebook,2022-08-09T08:48:39Z,2022-10-24T09:22:31Z,0,14,0,
452,mplcal,meta4,Create a standard calendar view from python using matplotlib,https://github.com/meta4/mplcal,Python,2020-06-04T08:03:31Z,2024-09-19T00:23:09Z,18,8,3,"BSD 2-Clause ""Simplified"" License"
453,CSV,johnnybhojwani,class project for using CSV and matplotlib in Python,https://github.com/johnnybhojwani/CSV,Python,2020-01-24T20:48:20Z,2023-02-21T17:58:06Z,0,29,0,
454,mpl_plot_templates,keflavich,Matplotlib plot templates,https://github.com/keflavich/mpl_plot_templates,Python,2013-12-16T15:45:48Z,2024-08-04T12:10:42Z,8,4,0,
455,mkplot,alexeyignatiev,A Python script to create cactus and scatter plots based on matplotlib,https://github.com/alexeyignatiev/mkplot,Python,2017-05-05T15:52:37Z,2024-05-06T05:39:08Z,23,11,0,MIT License
456,dsc-more-practice-with-matplotlib-nyc-ds-082619,learn-co-students,,https://github.com/learn-co-students/dsc-more-practice-with-matplotlib-nyc-ds-082619,Jupyter Notebook,2019-09-05T21:51:06Z,2019-10-21T14:00:17Z,0,20,0,Other
457,pyCircos,ponnhide,python Circos,https://github.com/ponnhide/pyCircos,Python,2018-01-19T17:38:45Z,2024-09-27T09:19:21Z,338,66,11,GNU General Public License v3.0
458,drawilleplot,gooofy,matplotlib backend for graph output in unicode terminals using drawille,https://github.com/gooofy/drawilleplot,Python,2019-11-28T22:38:24Z,2024-08-21T17:31:41Z,77,5,6,Apache License 2.0
459,crab,python-recsys,"Crab is a ﬂexible, fast recommender engine for Python that integrates classic information ﬁltering recommendation algorithms in the world of scientiﬁc Python packages (python, numpy, scipy, matplotlib)",https://github.com/python-recsys/crab,Python,2012-08-03T20:42:42Z,2024-07-09T10:20:40Z,127,73,5,Other
460,deeplearning-cv-notes,jayboxyz,:notebook: deepleaning and cv notes.,https://github.com/jayboxyz/deeplearning-cv-notes,Jupyter Notebook,2018-10-08T01:08:39Z,2024-09-25T02:37:11Z,342,123,37,
461,vector-fields,sleeping-h,Artistic visualization of vector fields created with Matplotlib and Jupyter Notebook,https://github.com/sleeping-h/vector-fields,Jupyter Notebook,2021-12-12T16:22:33Z,2024-08-08T14:34:34Z,37,8,0,MIT License
462,NiChord,paulcbogdan,Package for visualizing brain networks. Creates chord diagrams drawn using matplotlib,https://github.com/paulcbogdan/NiChord,Python,2022-05-22T00:45:12Z,2024-09-22T04:57:00Z,73,6,0,MIT License
463,matplotlive,stephane-caron,Stream live plots to a matplotlib figure,https://github.com/stephane-caron/matplotlive,Python,2024-05-09T07:29:19Z,2024-09-30T05:02:52Z,72,3,0,Apache License 2.0
464,cis277-fa22-Lab5,FHU,Data Visualization with matplotlib on NFL data,https://github.com/FHU/cis277-fa22-Lab5,Jupyter Notebook,2022-10-14T15:10:07Z,2022-10-14T15:10:12Z,0,17,0,
465,matplotlib,geekori,mtplotlib视频课程源代码,https://github.com/geekori/matplotlib,Python,2018-10-30T07:22:11Z,2022-07-27T15:17:59Z,6,3,0,
466,graphcat,Orange-Cyberdefense,Generate graphs and charts based on password cracking result,https://github.com/Orange-Cyberdefense/graphcat,Python,2023-02-17T14:26:22Z,2024-10-03T05:16:58Z,153,12,3,MIT License
467,PhysicsExp,regymm,USTC Physics Experiments Data Processing Tools (大物实验数据处理工具),https://github.com/regymm/PhysicsExp,Python,2018-03-24T08:13:35Z,2024-09-23T08:16:10Z,40,6,1,MIT License
468,dsc-more-practice-with-matplotlib-hbs-ds-060120,learn-co-students,,https://github.com/learn-co-students/dsc-more-practice-with-matplotlib-hbs-ds-060120,Jupyter Notebook,2020-06-01T13:16:48Z,2020-06-01T13:16:57Z,0,19,0,Other
469,python_simple_mppi,MizuhoAOKI,Python implementation of MPPI (Model Predictive Path-Integral) controller to understand the basic idea. Mandatory dependencies are numpy and matplotlib only.,https://github.com/MizuhoAOKI/python_simple_mppi,Jupyter Notebook,2023-09-10T03:28:27Z,2024-10-05T02:53:22Z,202,20,6,Other
470,recursive-voronoi,rougier,Recursive voronoi diagram,https://github.com/rougier/recursive-voronoi,Python,2019-08-28T08:21:02Z,2024-08-19T12:55:02Z,60,5,0,"BSD 2-Clause ""Simplified"" License"
471,pypick,ar4,Seismic event picking using Matplotlib and machine learning,https://github.com/ar4/pypick,Jupyter Notebook,2017-10-22T14:29:55Z,2024-03-06T02:26:54Z,14,6,0,MIT License
472,coronavirus_visualization_and_prediction,therealcyberlord,"This repository tracks the spread of the novel coronavirus, also known as SARS-CoV-2. It is a contagious respiratory virus that first started in Wuhan in December 2019. On 2/11/2020, the disease is officially named COVID-19 by the World Health Organization.",https://github.com/therealcyberlord/coronavirus_visualization_and_prediction,Jupyter Notebook,2020-03-08T16:36:05Z,2024-05-03T10:58:02Z,76,62,2,
473,ds-matplotlib-intro-readme-nyc-ds-career-012819,learn-co-students,,https://github.com/learn-co-students/ds-matplotlib-intro-readme-nyc-ds-career-012819,Jupyter Notebook,2019-02-04T15:53:34Z,2019-02-04T15:53:44Z,0,19,0,
474,CMasher,1313e,"Scientific colormaps for making accessible, informative and 'cmashing' plots",https://github.com/1313e/CMasher,Python,2019-11-16T06:15:58Z,2024-10-05T15:51:32Z,420,29,8,"BSD 3-Clause ""New"" or ""Revised"" License"
475,matplotlib,kivy-garden,Matplotlib backends using kivy (migration a WIP),https://github.com/kivy-garden/matplotlib,Python,2023-09-22T16:54:30Z,2024-08-22T18:49:18Z,6,3,3,MIT License
476,Day8-Lab2-Matplotlib,BKSalman,,https://github.com/BKSalman/Day8-Lab2-Matplotlib,Jupyter Notebook,2022-08-09T10:16:10Z,2022-10-24T09:22:31Z,0,13,0,
477,matplotrecorder,AtsushiSakai,A simple Python module for recording matplotlib animation,https://github.com/AtsushiSakai/matplotrecorder,Python,2017-04-18T17:54:26Z,2024-09-28T04:46:54Z,29,5,0,MIT License
478,py311,PythonistaMX,py311 Tratamiento y visualización de datos con Pandas y Matplotlib,https://github.com/PythonistaMX/py311,Jupyter Notebook,2018-12-17T17:53:22Z,2022-12-14T22:55:59Z,10,10,1,MIT License
479,comparing-tcp-algorithms,haltaro,Simulating TCP congestion control algorithms with ns-3 and visualizing the result with matplotlib.,https://github.com/haltaro/comparing-tcp-algorithms,C++,2017-02-13T23:47:02Z,2024-09-23T09:21:13Z,41,12,3,MIT License
480,Data-Visualization-Recipes-with-Python-and-Matplotlib-3,PacktPublishing,,https://github.com/PacktPublishing/Data-Visualization-Recipes-with-Python-and-Matplotlib-3,Jupyter Notebook,2019-02-28T07:47:03Z,2023-08-19T00:15:32Z,7,9,0,MIT License
481,lab-matplotlib-seaborn,Ironhack-Data-Madrid-Febrero-2021,,https://github.com/Ironhack-Data-Madrid-Febrero-2021/lab-matplotlib-seaborn,Jupyter Notebook,2021-03-15T20:00:46Z,2021-03-15T20:01:15Z,0,10,1,
482,PlotQCircuit,rpmuller,Visualize quantum circuits with matplotlib,https://github.com/rpmuller/PlotQCircuit,Jupyter Notebook,2017-03-24T20:05:07Z,2024-08-02T08:46:31Z,9,5,0,"BSD 2-Clause ""Simplified"" License"
483,data-visualisation-scripts,Perishleaf,Collection of scripts for data visualisation and good code practice.,https://github.com/Perishleaf/data-visualisation-scripts,Jupyter Notebook,2019-12-22T01:12:45Z,2024-08-31T20:53:05Z,105,98,2,MIT License
