,Repository_Name,Owner,Description,URL,Programming_Language,Creation_Date,Last_Updated_Date,Number_of_Stars,Number_of_Forks,Number_of_Open_Issues,License_Type
121,astronomy-notebooks,skyfielders,"iPython Notebooks showing off NumPy, matplotlib, and our universe",https://github.com/skyfielders/astronomy-notebooks,Jupyter Notebook,2012-12-02T21:58:26Z,2024-08-05T19:43:22Z,118,52,3,MIT License
122,matplotlib.rb,mrkn,matplotlib wrapper for Ruby,https://github.com/mrkn/matplotlib.rb,Ruby,2016-10-05T16:14:36Z,2024-10-05T20:43:30Z,92,10,8,MIT License
123,matplotlib-intro-tut-zh,jdk6979,:book: [译] Matplotlib 入门教程,https://github.com/jdk6979/matplotlib-intro-tut-zh,CSS,2017-01-15T06:52:41Z,2023-09-11T02:23:39Z,11,38,0,
124,lab-matplotlib-seaborn,ta-data-pt-rmt,,https://github.com/ta-data-pt-rmt/lab-matplotlib-seaborn,Jupyter Notebook,2022-02-27T17:31:33Z,2024-05-14T19:06:40Z,0,91,54,
125,pandas_alive,JackMcKew,"Create stunning, animated visualisations with Pandas & Matplotlib as easy as calling  `df.plot_animated()`",https://github.com/JackMcKew/pandas_alive,Python,2020-05-02T22:18:27Z,2024-09-12T13:07:58Z,581,100,18,MIT License
126,adjustText,Phlya,A small library for automatically adjustment of text position in matplotlib plots to minimize overlaps.,https://github.com/Phlya/adjustText,Jupyter Notebook,2016-01-10T02:11:06Z,2024-10-05T06:42:10Z,1486,87,36,MIT License
127,pytest-mpl,matplotlib,A pytest plugin to facilitate image comparison for Matplotlib figures,https://github.com/matplotlib/pytest-mpl,Python,2015-06-25T15:09:39Z,2024-09-30T12:12:08Z,241,47,39,Other
128,mplcairo,matplotlib,A (new) cairo backend for Matplotlib.,https://github.com/matplotlib/mplcairo,C++,2017-06-26T05:17:11Z,2024-09-19T11:08:18Z,106,22,5,MIT License
129,lab-matplotlib-seaborn,ta-data-mexpt,,https://github.com/ta-data-mexpt/lab-matplotlib-seaborn,Jupyter Notebook,2020-03-21T20:17:12Z,2020-03-21T20:18:06Z,0,83,19,
130,mplexporter,mpld3,A general scraper/exporter for matplotlib plots,https://github.com/mpld3/mplexporter,Python,2014-02-14T23:23:32Z,2024-08-12T06:21:36Z,48,39,9,"BSD 3-Clause ""New"" or ""Revised"" License"
131,Matplotlib_Essentials,weijie-chen,An Essential Graphic Primer of Matplotlib,https://github.com/weijie-chen/Matplotlib_Essentials,Jupyter Notebook,2020-06-21T17:16:33Z,2024-06-09T00:11:29Z,27,16,0,MIT License
132,JSAnimation,jakevdp,[DEPRECATED] An IPython notebook-compatible Javascript/HTML viewer for matplotlib animations,https://github.com/jakevdp/JSAnimation,Jupyter Notebook,2013-05-17T08:12:53Z,2024-08-12T19:22:24Z,240,59,4,"BSD 2-Clause ""Simplified"" License"
133,imutils,PyImageSearch,"A series of convenience functions to make basic image processing operations such as translation, rotation, resizing, skeletonization, and displaying Matplotlib images easier with OpenCV and Python.",https://github.com/PyImageSearch/imutils,Python,2015-01-11T20:05:39Z,2024-10-05T04:35:08Z,4530,1024,162,MIT License
134,mplStyle,nasa,Matplotlib object oriented style system,https://github.com/nasa/mplStyle,Python,2014-12-11T22:43:30Z,2023-11-06T13:59:51Z,44,23,1,Other
135,awesome-matplotlib,interactivetech, A curated list of awesome repos and tutorials to develop great matplotlib graphs and diagrams,https://github.com/interactivetech/awesome-matplotlib,,2021-06-25T23:02:43Z,2024-03-27T00:54:43Z,165,6,0,MIT License
136,matplotlib-style-gallery,tonysyu,A gallery displaying stylesheets for Matplotlib,https://github.com/tonysyu/matplotlib-style-gallery,Python,2014-12-08T06:33:45Z,2024-07-02T20:10:12Z,73,12,1,"BSD 3-Clause ""New"" or ""Revised"" License"
137,notebooks,masteringmatplotlib,Notebook index for Mastering matplotlib,https://github.com/masteringmatplotlib/notebooks,,2015-05-04T03:17:34Z,2024-02-10T17:23:42Z,45,22,0,
138,Matplotlib.Net,SciSharp,.NET wrapper for the Python plotting library Matplotlib,https://github.com/SciSharp/Matplotlib.Net,C#,2019-05-18T19:58:08Z,2024-09-13T02:16:49Z,53,11,0,Apache License 2.0
139,mplcursors,anntzer,Interactive data selection cursors for Matplotlib.,https://github.com/anntzer/mplcursors,Python,2016-07-20T08:20:36Z,2024-09-09T11:50:40Z,113,19,11,zlib License
140,plottable,znstrider,most pretty & lovely tables with matplotlib,https://github.com/znstrider/plottable,Python,2022-10-12T08:50:19Z,2024-10-06T14:44:39Z,252,13,11,MIT License
141,tueplots,pnkraemer,"Figure sizes, font sizes, fonts, and more configurations at minimal overhead. Fix your journal papers, conference proceedings, and other scientific publications.",https://github.com/pnkraemer/tueplots,Python,2021-12-07T13:38:51Z,2024-10-04T07:05:50Z,668,25,8,MIT License
142,itermplot,daleroberts,"An awesome iTerm2 backend for Matplotlib, so you can plot directly in your terminal.",https://github.com/daleroberts/itermplot,Python,2017-01-11T06:01:01Z,2024-09-26T00:50:03Z,1492,51,25,
143,AnimatedPythonPatterns,eleanorlutz,Animated GIF patterns made in Python Matplotlib.,https://github.com/eleanorlutz/AnimatedPythonPatterns,Jupyter Notebook,2016-11-15T20:04:41Z,2024-10-06T14:43:59Z,170,20,0,GNU General Public License v3.0
144,PyMICAPS,flashlxy,气象数据可视化，用matplotlib和basemap绘制micaps数据,https://github.com/flashlxy/PyMICAPS,Python,2017-04-06T04:01:29Z,2024-10-01T15:47:15Z,374,156,5,GNU General Public License v2.0
145,Data-Visualization-with-Python,TirendazAcademy,Data Visualization Tutorial | Matplotlib | Seaborn | Pandas  ,https://github.com/TirendazAcademy/Data-Visualization-with-Python,Jupyter Notebook,2021-02-26T11:29:20Z,2024-10-06T06:35:22Z,42,27,0,
146,data-science-types,wearepal,"Mypy stubs, i.e., type information, for numpy, pandas and matplotlib",https://github.com/wearepal/data-science-types,Python,2019-09-20T11:45:49Z,2024-04-14T01:02:33Z,202,51,39,Apache License 2.0
147,pandas-matplotlib-example,softporcupine,,https://github.com/softporcupine/pandas-matplotlib-example,,2015-09-23T23:05:34Z,2022-07-05T11:03:00Z,23,18,2,
148,pyplot-fortran,jacobwilliams,For generating plots from Fortran using Python's matplotlib.pyplot 📈,https://github.com/jacobwilliams/pyplot-fortran,Fortran,2015-04-18T16:23:29Z,2024-09-30T08:06:12Z,195,52,3,Other
149,lab-matplotlib-seaborn,ta-data-mex,,https://github.com/ta-data-mex/lab-matplotlib-seaborn,Jupyter Notebook,2019-07-22T03:23:19Z,2020-02-16T15:39:19Z,1,66,33,
150,matplotlibrc,bbarad,Settings file for matplotlib to maximize figure niceness.,https://github.com/bbarad/matplotlibrc,Python,2014-08-17T21:13:02Z,2023-01-07T12:19:02Z,33,10,1,MIT License
151,pretty-print-confusion-matrix,wcipriano,Confusion Matrix in Python: plot a pretty confusion matrix (like Matlab) in python using seaborn and matplotlib,https://github.com/wcipriano/pretty-print-confusion-matrix,Python,2018-07-03T15:47:33Z,2024-10-04T11:00:08Z,528,152,9,Apache License 2.0
152,Matplotlib-2.x-By-Example,PacktPublishing,"Matplotlib 2.x By Example, published by Packt",https://github.com/PacktPublishing/Matplotlib-2.x-By-Example,Jupyter Notebook,2017-08-22T09:28:40Z,2022-05-26T16:45:51Z,29,24,0,MIT License
153,exploratory_data_analysis,Dataweekends,"Few tutorials on pandas, matplotlib and seaborn",https://github.com/Dataweekends/exploratory_data_analysis,Jupyter Notebook,2016-05-18T21:55:35Z,2023-11-16T04:53:03Z,26,40,0,MIT License
154,chartpy,cuemacro,"Easy to use Python API wrapper to plot charts with matplotlib, plotly, bokeh and more",https://github.com/cuemacro/chartpy,Python,2016-08-03T22:00:01Z,2024-10-01T23:27:50Z,547,92,7,Apache License 2.0
155,mplhep,scikit-hep,Extended histogram plotting on top of matplotlib and HEP collaboration compatible styling,https://github.com/scikit-hep/mplhep,Python,2019-05-02T09:41:43Z,2024-10-03T10:22:32Z,186,64,35,MIT License
156,matplotlib_venn_wordcloud,paulbrodersen,Venn diagrams with word clouds,https://github.com/paulbrodersen/matplotlib_venn_wordcloud,Python,2017-03-29T16:34:29Z,2024-10-05T03:48:11Z,50,12,1,MIT License
157,prettyplots,yobibyte,Design your own matplotlib stylefile interactively,https://github.com/yobibyte/prettyplots,Jupyter Notebook,2021-04-20T16:48:56Z,2024-06-24T21:22:29Z,216,12,0,
158,gallery,rougier,Gallery of matplotlib samples,https://github.com/rougier/gallery,Python,2012-02-23T13:41:13Z,2023-11-14T13:56:52Z,46,14,0,
159,mpldatacursor,joferkington,"Interactive ""data cursors"" (a.k.a. annotation pop-ups) for matplotlib",https://github.com/joferkington/mpldatacursor,Python,2013-02-22T04:02:58Z,2024-07-26T19:45:27Z,194,47,41,MIT License
160,bg-mpl-stylesheets,Billingegroup,Matplotlib style sheets,https://github.com/Billingegroup/bg-mpl-stylesheets,Python,2017-02-23T20:55:44Z,2024-10-03T18:23:15Z,5,27,3,Other
161,CC-python-pandas-matplotlib,ourcodingclub,Data Analysis and Visualisation in Python using matplotlib and pandas,https://github.com/ourcodingclub/CC-python-pandas-matplotlib,,2018-04-23T16:32:42Z,2022-05-25T22:33:51Z,3,47,0,
162,scipy-lecture-notes-zh-CN,jayleicn,"中文版scipy-lecture-notes.  网站下线, 以离线HTML的形式继续更新, 见release.",https://github.com/jayleicn/scipy-lecture-notes-zh-CN,Python,2016-02-12T08:12:03Z,2024-09-13T09:38:58Z,410,174,2,Other
163,matplotlib-multilayer-network,jkbren,small template code to create a multilayer network using matplotlib and networkx,https://github.com/jkbren/matplotlib-multilayer-network,Jupyter Notebook,2020-07-30T12:20:22Z,2024-08-27T15:09:25Z,109,8,0,MIT License
164,30-Days-Of-Python,Asabeneh,"30 days of Python programming challenge is a step-by-step guide to learn the Python programming language in 30 days. This challenge may take more than100 days, follow your own pace.  These videos may help too: https://www.youtube.com/channel/UC7PNRuno1rzYPb1xLa4yktw",https://github.com/Asabeneh/30-Days-Of-Python,Python,2019-11-19T17:24:16Z,2024-10-06T14:37:39Z,41753,7962,198,
165,matplotlib_qtquick_playground,fcollonval,Matplotlib and PyQt - QtWidgets vs QtQuick,https://github.com/fcollonval/matplotlib_qtquick_playground,Python,2016-11-06T14:09:47Z,2024-02-27T09:45:46Z,22,14,0,MIT License
166,MatplotlibClass,ZhaoZhonglun1991,,https://github.com/ZhaoZhonglun1991/MatplotlibClass,Python,2017-09-21T14:06:44Z,2019-08-12T14:24:51Z,9,9,1,
167,plotty,ethz-asl,matplotlib-cpp with Eigen interfaces. ,https://github.com/ethz-asl/plotty,C++,2017-03-06T14:15:33Z,2024-09-09T13:38:32Z,52,15,4,Other
168,nc-time-axis,SciTools,Provides support for a cftime axis in matplotlib,https://github.com/SciTools/nc-time-axis,Python,2016-06-21T12:50:47Z,2024-10-05T00:33:17Z,58,31,9,"BSD 3-Clause ""New"" or ""Revised"" License"
169,styx,go-pluto,"Export Data from Prometheus to csv, gnuplot & matplotlib",https://github.com/go-pluto/styx,Go,2017-08-16T21:36:01Z,2024-09-22T20:11:43Z,99,24,6,MIT License
170,PyCINRAD,CyanideCN,Decode CINRAD (China New Generation Weather Radar) data and visualize.,https://github.com/CyanideCN/PyCINRAD,Python,2018-06-29T13:52:59Z,2024-09-29T21:49:35Z,368,155,10,GNU General Public License v3.0
171,PRE_matplotlib_networkx,jdvelasq,,https://github.com/jdvelasq/PRE_matplotlib_networkx,Python,2024-02-20T13:26:20Z,2024-02-23T16:37:59Z,0,62,0,
172,python_data_science,andreivmaksimov,"Docker container with Jupyter, Matplotlib, Pandas, Tensorflow and Keras",https://github.com/andreivmaksimov/python_data_science,Jupyter Notebook,2017-12-08T12:12:01Z,2024-09-23T23:01:16Z,45,42,1,MIT License
173,matplotlib-draggable-plot,yuma-m,An example of draggable plot for matplotlib,https://github.com/yuma-m/matplotlib-draggable-plot,Python,2017-09-11T15:01:13Z,2024-05-28T23:31:03Z,39,11,0,
174,calendar-heatmap,rougier,Calendar heatmap with matplotlib and random data,https://github.com/rougier/calendar-heatmap,Python,2019-08-03T07:25:53Z,2024-02-27T10:40:00Z,95,18,1,"BSD 2-Clause ""Simplified"" License"
175,Matplotlib-for-Python-Developers-Second-Edition,PacktPublishing,"Matplotlib for Python Developers, Second Edition by Packt",https://github.com/PacktPublishing/Matplotlib-for-Python-Developers-Second-Edition,Jupyter Notebook,2018-04-02T07:00:50Z,2024-02-01T08:30:09Z,25,25,0,MIT License
176,js-colormaps,timothygebhard,Matplotlib colormaps made available in JavaScript,https://github.com/timothygebhard/js-colormaps,Python,2015-08-12T08:17:46Z,2024-08-05T07:09:55Z,67,16,1,MIT License
177,svgpath2mpl,nvictus,SVG path parser for matplotlib,https://github.com/nvictus/svgpath2mpl,Python,2016-04-10T06:47:11Z,2024-10-06T07:23:59Z,61,13,0,"BSD 3-Clause ""New"" or ""Revised"" License"
178,hiveplot,ericmjl,Hive Plots in using Python & matplotlib!,https://github.com/ericmjl/hiveplot,Jupyter Notebook,2015-02-18T21:20:16Z,2024-09-25T13:03:14Z,70,15,5,MIT License
179,Data-Visualization-with-Python,TrainingByPackt,Discover how Matplotlib and Seaborn can help clearly communicate and present your newly acquired insight,https://github.com/TrainingByPackt/Data-Visualization-with-Python,Jupyter Notebook,2018-10-05T04:47:08Z,2024-09-22T06:42:59Z,106,113,0,MIT License
180,matplotlib-pyodide,pyodide,HTML5 backends for Matplotlib compatible with Pyodide,https://github.com/pyodide/matplotlib-pyodide,Python,2022-09-02T06:58:39Z,2024-09-30T04:52:37Z,31,9,24,Mozilla Public License 2.0
181,matplotlib-sixel,koppa,A sixel graphics backend for matplotlib,https://github.com/koppa/matplotlib-sixel,Python,2016-10-06T10:41:44Z,2024-09-11T16:48:08Z,39,8,1,"BSD 3-Clause ""New"" or ""Revised"" License"
182,matplotlib,Asabeneh,,https://github.com/Asabeneh/matplotlib,Jupyter Notebook,2021-07-08T02:44:03Z,2024-08-31T02:50:50Z,17,7,0,
183,TileMapBase,MatthewDaws,Use OpenStreetMap tiles as basemaps in python / matplotlib,https://github.com/MatthewDaws/TileMapBase,Jupyter Notebook,2017-05-15T19:57:11Z,2024-09-26T01:35:52Z,89,20,7,MIT License
184,ant-learn-visualization,peiss,python Visualization，using pyecharts、matplotlib、seaborn,https://github.com/peiss/ant-learn-visualization,Jupyter Notebook,2020-03-16T11:13:38Z,2024-09-16T12:23:22Z,26,21,0,
185,Python3.x_Matplotlib,kelasterbuka,,https://github.com/kelasterbuka/Python3.x_Matplotlib,Python,2018-09-09T22:05:05Z,2024-06-22T09:10:56Z,12,19,0,Apache License 2.0
186,DataScience-master,GISWLH,"Machine Learning, Python, Deep Learning, Linux, Pandas, Matplotlib, Git...",https://github.com/GISWLH/DataScience-master,,2023-06-27T07:40:23Z,2024-09-29T01:56:28Z,99,25,1,MIT License
187,viscm,matplotlib,A tool for visualizing and designing colormaps using colorspacious and matplotlib,https://github.com/matplotlib/viscm,Python,2015-07-04T07:06:05Z,2024-07-23T18:21:48Z,164,32,9,MIT License
188,PyEnergyDiagrams,giacomomarchioro,This is a simple script to plot energy profile diagrams using Python and matplotlib.,https://github.com/giacomomarchioro/PyEnergyDiagrams,Python,2017-01-24T08:38:09Z,2024-09-25T08:30:04Z,150,61,4,MIT License
189,HowToMakeAPlot,cajohare,Matplotlib tutorials,https://github.com/cajohare/HowToMakeAPlot,Jupyter Notebook,2023-11-26T10:13:54Z,2024-10-03T07:46:22Z,100,4,1,
190,skulpt_matplotlib,ebertmi,Partial matplotlib pyplot implementation for skulpt,https://github.com/ebertmi/skulpt_matplotlib,JavaScript,2014-07-28T16:39:45Z,2024-02-08T08:31:05Z,10,13,3,
191,matplotlib-tutorials,sonofacorner,The Jupyter notebooks behind my my matplotlib tutorials.,https://github.com/sonofacorner/matplotlib-tutorials,Jupyter Notebook,2022-08-16T17:38:21Z,2024-08-12T14:28:15Z,30,8,1,
192,crab,muricoca,"Crab is a ﬂexible, fast recommender engine for Python that integrates classic information ﬁltering recommendation algorithms in the world of scientiﬁc Python packages (numpy, scipy, matplotlib).",https://github.com/muricoca/crab,Python,2011-04-19T02:08:08Z,2024-09-21T20:30:31Z,1177,376,47,Other
193,pySankey2,SZJShuffle,Static Sankey diagrams with matplotlib,https://github.com/SZJShuffle/pySankey2,Jupyter Notebook,2020-06-26T04:24:23Z,2024-09-13T15:39:52Z,38,11,6,GNU Lesser General Public License v3.0
194,smplotlib,AstroJacobLi,Matplotlib template for SuperMongo style 🔭,https://github.com/AstroJacobLi/smplotlib,Python,2023-04-14T00:58:25Z,2024-09-29T08:28:51Z,127,8,1,MIT License
195,matplotlib-tutorial,story645,Beyond Defaults: Creating Polished Visualizations Using Matplotlib ,https://github.com/story645/matplotlib-tutorial,Python,2014-04-10T02:42:29Z,2022-09-10T06:15:35Z,13,10,0,
196,3D-bin-packing,jerry800416,3D Bin Packing improvements based on https://github.com/enzoruiz/3dbinpacking,https://github.com/jerry800416/3D-bin-packing,Python,2021-09-27T07:18:39Z,2024-10-05T09:40:49Z,158,44,9,MIT License
197,matplotlib_plot_style,chend2023,,https://github.com/chend2023/matplotlib_plot_style,Python,2023-05-14T13:40:02Z,2024-09-21T13:57:35Z,42,7,0,
198,matplotlib-extension-cookiecutter,matplotlib,A fairly opinionated cookiecutter for making a Matplotlib extension,https://github.com/matplotlib/matplotlib-extension-cookiecutter,Python,2021-02-17T00:57:49Z,2024-08-13T06:03:32Z,30,8,5,
199,mpltex,liuyxpp,A python package for producing publication quality images using matplotlib.,https://github.com/liuyxpp/mpltex,Python,2014-09-05T01:42:35Z,2024-10-03T21:58:47Z,91,22,0,Other
200,geoplot,ResidentMario,High-level geospatial data visualization library for Python.,https://github.com/ResidentMario/geoplot,Python,2016-06-29T00:11:33Z,2024-09-25T00:50:39Z,1146,95,29,MIT License
201,videofig,bilylee,Lightweight image sequence visualization utility based on matplotlib,https://github.com/bilylee/videofig,Python,2017-05-10T03:15:11Z,2024-05-20T00:38:00Z,53,17,0,MIT License
202,mpl-probscale,matplotlib,Real probability scales for matplotlib,https://github.com/matplotlib/mpl-probscale,Python,2015-11-20T02:10:03Z,2024-09-17T07:19:47Z,37,9,7,"BSD 3-Clause ""New"" or ""Revised"" License"
203,make-a-map-geopandas,bendoesdata,Tutorial on how to make a choropleth map using Geopandas and Matplotlib in Python.,https://github.com/bendoesdata/make-a-map-geopandas,Jupyter Notebook,2018-06-25T09:22:48Z,2024-08-21T18:14:04Z,91,53,2,
204,machineLearning_breastCancer_Python,raviolli77,"Machine Learning Applications using Sklearn, matplotlib, pandas, and seaborn ",https://github.com/raviolli77/machineLearning_breastCancer_Python,HTML,2017-01-18T08:05:40Z,2024-04-03T07:06:02Z,33,26,13,MIT License
205,python-notlarim,fuatbeser,Python notes in Turkish. ,https://github.com/fuatbeser/python-notlarim,Jupyter Notebook,2018-08-22T21:29:22Z,2024-08-12T19:41:03Z,377,61,0,
206,matplotlib-wheels,MacPython,Automated builds of OSX wheels,https://github.com/MacPython/matplotlib-wheels,Shell,2014-06-30T16:12:44Z,2023-11-02T01:58:30Z,6,13,0,
207,matplotlib-stock,lugeek,使用Python-Matplotlib查看股票走势图,https://github.com/lugeek/matplotlib-stock,Python,2015-07-07T03:36:58Z,2023-08-06T12:05:26Z,7,12,0,
208,sorting-visualizer,zamhown,📊 Some python scripts which can visualize several famous sorting algorithms and generate the animations via Matplotlib.,https://github.com/zamhown/sorting-visualizer,Python,2018-06-16T09:59:44Z,2024-10-05T05:04:27Z,239,69,0,MIT License
209,taming_matplotlib,brohrer,Tutorials for getting the most out of Matplotlib,https://github.com/brohrer/taming_matplotlib,Python,2019-03-22T16:25:22Z,2024-07-11T01:29:19Z,23,7,0,
210,lab-matplotlib-seaborn,ta-datapt-bcn,,https://github.com/ta-datapt-bcn/lab-matplotlib-seaborn,Jupyter Notebook,2019-08-01T19:12:19Z,2020-08-25T19:48:46Z,0,32,0,
211,matplotlib-hep,ibab,:zap: An addon to matplotlib for creating high energy physics plots,https://github.com/ibab/matplotlib-hep,Python,2016-02-04T02:14:16Z,2024-03-19T13:59:27Z,13,9,2,MIT License
212,creative-matplotlib,sadielbartholomew,Creative coding scripts and outputs using vanilla matplotlib,https://github.com/sadielbartholomew/creative-matplotlib,Jupyter Notebook,2019-03-23T09:57:25Z,2024-05-22T17:34:33Z,48,5,1,MIT License
213,flexitext,tomicapretto,Flexitext: Draw styled text in Matplotlib,https://github.com/tomicapretto/flexitext,Python,2021-09-16T23:18:34Z,2024-09-24T02:46:45Z,113,8,7,MIT License
214,curso-matplotlib,alura-cursos,,https://github.com/alura-cursos/curso-matplotlib,,2020-03-13T11:58:05Z,2024-04-13T14:30:20Z,12,9,0,
215,plotting-examples,VictoriaLynn,"Simple examples of Matlab, R, and Matplotlib (Python) plotting tools.",https://github.com/VictoriaLynn/plotting-examples,Python,2013-05-14T15:36:48Z,2024-05-02T22:05:19Z,30,30,0,
216,abu,bbfamily,阿布量化交易系统(股票，期权，期货，比特币，机器学习) 基于python的开源量化交易，量化投资架构,https://github.com/bbfamily/abu,Python,2016-09-19T15:31:53Z,2024-10-06T01:52:37Z,11858,3745,3,GNU General Public License v3.0
217,sarviewer,juliojsb,Generate graphs with gnuplot or matplotlib (Python) from sar data,https://github.com/juliojsb/sarviewer,Python,2016-06-12T20:47:40Z,2024-08-21T07:32:55Z,69,21,0,GNU General Public License v3.0
218,madplotlib,madplotlib,"A C++ wrapper of Qt Charts that looks, tastes and smells like matplotlib but isn't.",https://github.com/madplotlib/madplotlib,C++,2017-06-09T20:17:46Z,2024-09-23T15:25:56Z,253,46,0,MIT License
219,py-matplotlib,mate-academy,,https://github.com/mate-academy/py-matplotlib,Jupyter Notebook,2023-07-07T13:35:41Z,2023-07-13T13:48:43Z,0,172,163,
220,Introduction-to-NumPy-Matplotlib-TensorFlow,kmario23,NumPy fundamentals for tensor computation; Matplotlib for data visualization,https://github.com/kmario23/Introduction-to-NumPy-Matplotlib-TensorFlow,Jupyter Notebook,2018-10-17T02:02:12Z,2023-08-22T23:54:59Z,22,16,0,
221,dsc-more-practice-with-matplotlib-lab-online-ds-sp-000,learn-co-students,,https://github.com/learn-co-students/dsc-more-practice-with-matplotlib-lab-online-ds-sp-000,Jupyter Notebook,2019-07-10T03:12:38Z,2021-01-22T21:01:52Z,0,93,3,Other
222,matplotlib_backend_qtquick,jmitrevs,A QtQuick backend for matplotlib,https://github.com/jmitrevs/matplotlib_backend_qtquick,Python,2020-05-03T21:19:39Z,2024-07-28T14:54:51Z,20,8,5,Other
223,pywcsgrid2,leejjoon,astromonical fits image for python matplotlib,https://github.com/leejjoon/pywcsgrid2,Python,2009-06-21T03:01:58Z,2021-12-07T13:20:00Z,24,13,9,MIT License
224,Matplotlib-for-Storytellers,alexanderthclark,Python data visualization book,https://github.com/alexanderthclark/Matplotlib-for-Storytellers,Jupyter Notebook,2021-11-12T19:10:53Z,2024-09-18T16:54:19Z,27,7,1,Other
225,pyplot,kallyzhang113,An example of using matplotlib.pyplot,https://github.com/kallyzhang113/pyplot,Python,2018-09-09T12:35:40Z,2024-08-17T10:00:03Z,7,22,0,
226,toga-chart,beeware,A matplotlib charting widget for Toga.,https://github.com/beeware/toga-chart,Python,2018-08-29T01:52:23Z,2024-09-30T00:34:26Z,27,12,5,"BSD 3-Clause ""New"" or ""Revised"" License"
227,matplotlib-tutorials,daveebbelaar,,https://github.com/daveebbelaar/matplotlib-tutorials,Python,2022-08-11T13:49:47Z,2024-08-25T14:24:01Z,13,8,0,
228,awesome-matplotlib,paniterka,A curated list of various Matplotlib resources ,https://github.com/paniterka/awesome-matplotlib,,2022-10-26T20:42:41Z,2024-09-25T15:19:53Z,66,4,0,
229,dufte,nschloe,:chart_with_upwards_trend: Minimalistic Matplotlib style,https://github.com/nschloe/dufte,Python,2020-04-19T13:13:53Z,2024-09-05T16:46:50Z,216,6,0,MIT License
230,2021-bordeaux-dataviz,ASPP,Scientific Visualization Crash Course (Python & Matplotlib),https://github.com/ASPP/2021-bordeaux-dataviz,Jupyter Notebook,2020-08-09T20:23:57Z,2024-08-20T14:01:50Z,22,13,0,
231,kivy_matplotlib,jeysonm82,Simple widget to display a Matplotlib figure in kivy. Also a basic toolbar widget to pan and zoom the plot,https://github.com/jeysonm82/kivy_matplotlib,Python,2015-03-03T22:54:37Z,2024-07-21T13:22:21Z,17,7,4,
232,arxiv-matplotlib,mrocklin,,https://github.com/mrocklin/arxiv-matplotlib,Jupyter Notebook,2022-09-24T00:40:14Z,2024-06-03T00:02:37Z,37,6,1,"BSD 3-Clause ""New"" or ""Revised"" License"
233,KaggleStruggle,corazzon,Kaggle Struggle,https://github.com/corazzon/KaggleStruggle,Jupyter Notebook,2017-10-23T11:32:11Z,2024-09-28T06:23:57Z,298,291,0,MIT License
234,pygwalker,Kanaries,PyGWalker: Turn your pandas dataframe into an interactive UI for visual analysis,https://github.com/Kanaries/pygwalker,Python,2023-02-16T05:17:24Z,2024-10-06T14:04:19Z,12835,662,50,Apache License 2.0
235,strava_calendar,ColCarroll,Visualizations from Strava data in matplotlib,https://github.com/ColCarroll/strava_calendar,Python,2019-01-08T20:00:43Z,2024-08-18T17:18:31Z,85,7,2,MIT License
236,matplotlib-ancient,astraw,python 2D plotting library,https://github.com/astraw/matplotlib-ancient,Python,2008-12-04T00:50:49Z,2021-06-30T15:35:04Z,24,6,0,Other
237,matplotlib-cpp-starter,AtsushiSakai,This is a starter kit with matplotlib-cpp,https://github.com/AtsushiSakai/matplotlib-cpp-starter,C++,2016-01-15T13:18:47Z,2022-03-19T07:16:46Z,17,8,0,MIT License
238,kivy_matplotlib_widget,mp-007,A fast matplotlib rendering for Kivy based on Kivy_matplotlib project and kivy scatter. Matplotlib used 'agg' backend,https://github.com/mp-007/kivy_matplotlib_widget,Python,2021-11-27T01:35:20Z,2024-09-26T12:21:03Z,33,6,2,MIT License
239,PtitPrince,pog87,python version of raincloud,https://github.com/pog87/PtitPrince,Jupyter Notebook,2018-03-17T14:58:32Z,2024-09-09T11:52:59Z,261,50,9,MIT License
240,themepy,petermckeeverPerform,An open source theme selector for matplotlib,https://github.com/petermckeeverPerform/themepy,Python,2020-08-17T06:45:37Z,2024-08-22T19:23:48Z,71,9,3,MIT License
241,textalloc,ckjellson,Allocates text labels in matplotlib,https://github.com/ckjellson/textalloc,Jupyter Notebook,2022-10-30T16:24:35Z,2024-09-25T22:52:44Z,63,6,0,MIT License
242,lab-matplotlib-seaborn,Ironhack-data-bcn-oct-2023,,https://github.com/Ironhack-data-bcn-oct-2023/lab-matplotlib-seaborn,Jupyter Notebook,2023-10-08T16:50:56Z,2023-10-08T16:51:01Z,0,25,19,
243,half-car,nrsyed,Vehicle half-car suspension model animated in matplotlib,https://github.com/nrsyed/half-car,Python,2019-01-30T01:56:05Z,2024-09-25T21:24:08Z,32,15,2,GNU General Public License v3.0
