,Repository_Name,Owner,Description,URL,Programming_Language,Creation_Date,Last_Updated_Date,Number_of_Stars,Number_of_Forks,Number_of_Open_Issues,License_Type
244,tutorial_matplotlibCustomPlots,maticalderini,A tutorial on making custom plotting functions on matplotlib,https://github.com/maticalderini/tutorial_matplotlibCustomPlots,Jupyter Notebook,2020-04-27T22:57:21Z,2024-09-17T06:17:31Z,7,6,0,
245,audio-spectrum-matplotlib,lbgists," Frequency spectrum of sound using PyAudio, NumPy, and Matplotlib",https://github.com/lbgists/audio-spectrum-matplotlib,Python,2018-02-21T12:40:37Z,2023-11-29T11:41:45Z,14,8,0,
246,plotbitrate,zeroepoch,FFProbe Bitrate Graph,https://github.com/zeroepoch/plotbitrate,Python,2013-11-17T20:47:55Z,2024-10-05T16:46:16Z,313,43,0,Other
247,ocaml-matplotlib,LaurentMazare,Plotting for ocaml based on matplotlib.pyplot,https://github.com/LaurentMazare/ocaml-matplotlib,OCaml,2018-11-13T02:32:14Z,2024-09-18T16:42:11Z,30,5,3,MIT License
248,PyQt5_Matplotlib,idevloping,Making Desktop App with PyQt5 and matplotlib,https://github.com/idevloping/PyQt5_Matplotlib,Python,2019-12-19T21:46:54Z,2024-01-17T09:50:46Z,15,9,0,GNU General Public License v3.0
249,catscatter,myrthings,Scatter visualization for categorical features with matplotlib,https://github.com/myrthings/catscatter,Python,2020-04-02T22:42:21Z,2024-09-16T06:34:10Z,37,11,1,
250,matplotlib,ericliang,mirror of the maplotlib svn-repo: http://sourceforge.net/projects/matplotlib/,https://github.com/ericliang/matplotlib,,2011-01-22T07:51:03Z,2018-12-19T03:00:02Z,5,7,0,
251,mpl_plotter,alopezrivera,Publication-quality data representation library based on Matplotlib.,https://github.com/alopezrivera/mpl_plotter,Python,2020-07-17T07:34:37Z,2024-09-26T05:47:37Z,165,7,0,GNU General Public License v3.0
252,Hands-On-Data-Analysis-with-Pandas,stefmolin,Materials for following along with Hands-On Data Analysis with Pandas.,https://github.com/stefmolin/Hands-On-Data-Analysis-with-Pandas,Jupyter Notebook,2018-09-15T19:44:31Z,2024-08-26T18:41:31Z,410,812,0,MIT License
253,PythonPlot.jl,JuliaPy,Plotting for Julia based on matplotlib.pyplot,https://github.com/JuliaPy/PythonPlot.jl,Julia,2022-04-12T22:08:39Z,2024-09-22T23:44:28Z,74,8,13,MIT License
254,pytransform3d,dfki-ric,3D transformations for Python.,https://github.com/dfki-ric/pytransform3d,Python,2017-05-19T13:35:08Z,2024-10-06T11:59:16Z,626,67,11,Other
255,lab-matplotlib-seaborn,Ironhack-Data-Madrid-Octubre-2021,,https://github.com/Ironhack-Data-Madrid-Octubre-2021/lab-matplotlib-seaborn,Jupyter Notebook,2021-10-28T10:05:36Z,2021-10-28T12:59:46Z,0,24,25,
256,Matplotlib-Lab1,Milaakk,,https://github.com/Milaakk/Matplotlib-Lab1,Jupyter Notebook,2023-08-09T09:11:01Z,2023-08-09T11:31:50Z,0,23,0,
257,mpl_chord_diagram,tfardet,Plot chord diagrams with matplotlib,https://github.com/tfardet/mpl_chord_diagram,Python,2020-08-30T12:34:00Z,2024-08-12T03:54:01Z,49,7,1,MIT License
258,dexplot,dexplo,Simple plotting library that wraps Matplotlib and integrated with DataFrames,https://github.com/dexplo/dexplot,Jupyter Notebook,2018-08-21T16:32:10Z,2024-03-07T05:47:53Z,230,9,2,"BSD 3-Clause ""New"" or ""Revised"" License"
259,YouTube-Report,A3M4,:bar_chart: Generate a personal YouTube report from your Google Takeout data,https://github.com/A3M4/YouTube-Report,Python,2019-12-10T02:18:31Z,2024-09-24T11:50:49Z,642,62,19,MIT License
260,Matplotlib-Lab2,RynHb,,https://github.com/RynHb/Matplotlib-Lab2,Jupyter Notebook,2023-08-09T10:42:28Z,2023-08-09T11:42:40Z,0,23,0,
261,python,chokkan,Python早見帳,https://github.com/chokkan/python,Jupyter Notebook,2021-10-04T13:29:11Z,2024-09-24T02:34:54Z,262,20,1,Other
262,skunk,whitead,Insert SVG images into matplotlib elements. Can be used to also compose matplotlib plots by nesting them. ,https://github.com/whitead/skunk,Python,2021-09-04T18:25:54Z,2024-09-06T04:18:23Z,73,7,1,MIT License
263,matplotlib_python,InoveAlumnos,Material de clase y ejercicios acerca de Matplotlib,https://github.com/InoveAlumnos/matplotlib_python,Python,2020-07-13T01:56:52Z,2021-02-03T02:59:03Z,1,20,0,
264,Matplotlib-Lab2,albandari147,,https://github.com/albandari147/Matplotlib-Lab2,Jupyter Notebook,2023-05-24T11:14:03Z,2023-05-24T17:39:00Z,0,23,0,
265,python,fabianabarca,"Tutoriales de Python para el análisis de datos en el curso IE0405 - ""Modelos Probabilísticos de Señales y Sistemas"" de la Universidad de Costa Rica.",https://github.com/fabianabarca/python,Jupyter Notebook,2020-05-06T04:37:43Z,2024-09-19T17:20:19Z,382,166,1,Creative Commons Zero v1.0 Universal
266,Matplotlib-Lab1,SulaimanMAS,,https://github.com/SulaimanMAS/Matplotlib-Lab1,Jupyter Notebook,2023-01-19T08:48:00Z,2023-01-31T23:44:32Z,0,23,0,
267,lab-matplotlib-seaborn,paulagual,,https://github.com/paulagual/lab-matplotlib-seaborn,Jupyter Notebook,2019-08-01T19:19:13Z,2020-06-27T09:55:11Z,0,23,0,
268,jupyter-notebooks,jukuznets,Data visualizations created with Matplotlib,https://github.com/jukuznets/jupyter-notebooks,Jupyter Notebook,2020-11-22T13:10:11Z,2024-02-12T15:38:16Z,9,12,0,
269,5.2-lab_matplotlib_seaborn,Ironhack-Data-Madrid-Octubre-2023,,https://github.com/Ironhack-Data-Madrid-Octubre-2023/5.2-lab_matplotlib_seaborn,Jupyter Notebook,2023-10-02T08:09:24Z,2023-11-07T12:23:38Z,0,28,2,
270,Matplotlib-Lab1,SMalsenan,,https://github.com/SMalsenan/Matplotlib-Lab1,Jupyter Notebook,2023-05-24T09:00:26Z,2023-05-24T11:38:52Z,0,23,0,
271,Microcharts.Matplotlib,SciSharp,Microcharts.Matplotlib is a wrapper of Microcharts for Data Science and Machine Learning,https://github.com/SciSharp/Microcharts.Matplotlib,C#,2019-05-09T05:15:41Z,2024-06-20T08:33:33Z,22,5,1,Apache License 2.0
272,brainglobe-heatmap,brainglobe,Rendering anatomical heatmaps with brainrender and matplotlib,https://github.com/brainglobe/brainglobe-heatmap,Python,2021-12-27T20:56:04Z,2024-09-20T14:34:43Z,34,10,5,MIT License
273,ML-DL-implementation,RoboticsClubIITJ,An implementation of ML and DL algorithms from scratch in python using nothing but NumPy and Matplotlib.,https://github.com/RoboticsClubIITJ/ML-DL-implementation,Python,2020-08-04T17:39:50Z,2024-09-14T00:28:13Z,49,69,30,"BSD 3-Clause ""New"" or ""Revised"" License"
274,matplotlib,catppuccin,📊 Soothing pastel theme for Matplotlib,https://github.com/catppuccin/matplotlib,Python,2022-12-08T13:56:20Z,2024-07-09T23:30:49Z,71,2,1,MIT License
275,Matplotlib-Lab2,SulaimanMAS,,https://github.com/SulaimanMAS/Matplotlib-Lab2,Jupyter Notebook,2023-01-19T11:09:28Z,2023-01-19T16:11:32Z,0,22,0,
276,matplotlib-style-configurator,dhaitz,"Matplotlib style configurator, built with Streamlit",https://github.com/dhaitz/matplotlib-style-configurator,Python,2020-07-07T16:29:40Z,2024-06-07T20:40:31Z,29,5,0,MIT License
277,plotpy,cpmech,Rust plotting library using Python (Matplotlib),https://github.com/cpmech/plotpy,Rust,2021-08-15T12:35:44Z,2024-09-30T12:59:18Z,64,6,0,MIT License
278,nodeplotlib,ngfelixl,NodeJS plotting library for JavaScript and TypeScript. On top of plotly.js. Inspired by matplotlib.,https://github.com/ngfelixl/nodeplotlib,TypeScript,2018-09-19T06:26:02Z,2024-09-22T13:47:16Z,195,24,16,MIT License
279,latexipy,masasin,Generate beautiful plots for LaTeX using your existing matplotlib-based code.,https://github.com/masasin/latexipy,Python,2017-08-19T09:54:33Z,2024-01-04T16:16:34Z,129,13,18,MIT License
280,osmnx-matplotlib-animation,mikhailsirenko,How to animate objects moving on OSMnx graph?,https://github.com/mikhailsirenko/osmnx-matplotlib-animation,Jupyter Notebook,2020-06-05T22:14:16Z,2024-09-09T12:44:30Z,28,5,0,
281,Python-Sales-Data-Analysis,PetraLee2019,Python Pandas & Python Matplotlib - Sales Data Analysis ,https://github.com/PetraLee2019/Python-Sales-Data-Analysis,Jupyter Notebook,2020-05-06T20:28:24Z,2024-07-12T10:13:42Z,19,13,0,
282,altair_matplotlib,altair-viz,Matplotlib renderer for Altair,https://github.com/altair-viz/altair_matplotlib,Python,2016-11-03T21:29:21Z,2019-01-11T03:01:44Z,5,10,1,"BSD 3-Clause ""New"" or ""Revised"" License"
283,2021_course_dev-rougier,NFAcademy,NumFocus Academy - Matplotlib (beginner),https://github.com/NFAcademy/2021_course_dev-rougier,Jupyter Notebook,2021-06-16T05:02:11Z,2022-11-28T13:21:02Z,55,4,0,
284,highlight_text,znstrider,functions to plot text with <highlighted substrings> in matplotlib.,https://github.com/znstrider/highlight_text,Jupyter Notebook,2020-02-14T11:35:21Z,2024-09-19T01:06:07Z,115,8,1,MIT License
285,expyplot,MaxStrange,Matplotlib for Elixir,https://github.com/MaxStrange/expyplot,Elixir,2017-04-11T23:22:14Z,2024-07-09T00:39:41Z,33,4,0,MIT License
286,matplotlib-fill_between-in-3D,artmenlope,Example of a way of bringing the Python 3 matplotlib.pyplot.fill_between function to 3D plots.,https://github.com/artmenlope/matplotlib-fill_between-in-3D,Python,2020-03-22T15:37:30Z,2024-09-30T11:19:05Z,45,6,1,MIT License
287,Machine-Learning-with-Iris-Dataset,venky14,Data Visualization and Machine Learning with Iris Dataset.,https://github.com/venky14/Machine-Learning-with-Iris-Dataset,Jupyter Notebook,2017-08-02T07:26:41Z,2024-09-22T06:22:45Z,83,100,10,
288,maze,tpof314,用python和matplotlib库生成迷宫,https://github.com/tpof314/maze,Python,2018-07-01T04:58:19Z,2024-06-23T17:41:32Z,50,11,1,
289,OpenStudio_to_EnergyPlusAPI,jmarrec,"Python: using OpenStudio Bindings, EnergyPlus API, and matplotlib",https://github.com/jmarrec/OpenStudio_to_EnergyPlusAPI,Jupyter Notebook,2021-01-05T13:38:58Z,2024-10-01T15:13:54Z,51,9,1,
290,jupyter-tips-and-tricks,jbwhit,Using Project Jupyter for data science.,https://github.com/jbwhit/jupyter-tips-and-tricks,Jupyter Notebook,2015-05-25T21:12:49Z,2024-09-30T21:01:13Z,259,142,0,MIT License
291,Plot_scripts_Matplotlib,tamaswells,,https://github.com/tamaswells/Plot_scripts_Matplotlib,Python,2020-07-02T13:24:06Z,2022-07-27T10:13:09Z,6,9,0,
292,pylustrator,rgerum,"Visualisations of data are at the core of every publication of scientific research results. They have to be as clear as possible to facilitate the communication of research. As data can have different formats and shapes, the visualisations often have to be adapted to reflect the data as well as possible. We developed Pylustrator, an interface to directly edit python generated matplotlib graphs to finalize them for publication. Therefore, subplots can be resized and dragged around by the mouse, text and annotations can be added. The changes can be saved to the initial plot file as python code.",https://github.com/rgerum/pylustrator,Python,2018-06-21T07:03:41Z,2024-09-22T06:13:27Z,706,38,14,GNU General Public License v3.0
293,geneview,ShujiaHuang,Genomics data visualization in Python by using matplotlib.,https://github.com/ShujiaHuang/geneview,Python,2016-01-24T11:28:08Z,2024-09-21T17:10:49Z,61,8,2,GNU General Public License v3.0
294,python-fundamentals,npshub,":octocat: Python Basics with fundamental datastructure, loops, functions and class, input/output, plotting ",https://github.com/npshub/python-fundamentals,Jupyter Notebook,2020-05-30T22:13:34Z,2023-12-30T12:15:47Z,19,90,2,
295,Matplotlib,w1449550206,Matplotlib超详细的案例和说明,https://github.com/w1449550206/Matplotlib,Jupyter Notebook,2020-02-28T12:41:10Z,2024-02-29T12:23:05Z,20,3,0,
296,lhcb-matplotlibrc,kdungs,A matplotlibrc that produces plots close to the official LHCb style.,https://github.com/kdungs/lhcb-matplotlibrc,,2014-04-01T09:06:51Z,2024-04-21T16:47:22Z,16,5,0,MIT License
297,Data-Analysis-with-Python,susanli2016,"Data analysis using numpy, pandas, matplotlib, seaborn, sqlite3, data wrangling",https://github.com/susanli2016/Data-Analysis-with-Python,Jupyter Notebook,2017-03-10T06:06:17Z,2024-01-22T15:14:46Z,30,16,0,
298,LovelyPlots,killiansheriff,"Matplotlib style sheets to nicely format figures for scientific papers, thesis and presentations while keeping them fully editable in Adobe Illustrator.",https://github.com/killiansheriff/LovelyPlots,Python,2022-07-25T14:01:48Z,2024-10-01T16:25:00Z,842,34,0,MIT License
299,speck,lucashadfield,line art image renderer,https://github.com/lucashadfield/speck,Python,2019-12-27T22:03:29Z,2024-09-15T19:33:48Z,371,22,1,GNU General Public License v3.0
300,windrose,python-windrose,"A Python Matplotlib, Numpy library to manage wind data, draw windrose (also known as a polar rose plot), draw probability density function and fit Weibull distribution",https://github.com/python-windrose/windrose,Python,2015-06-16T18:42:14Z,2024-10-04T13:17:25Z,331,132,21,Other
301,nicar16-visualizing-data-python,robroc,Tutorial on visualizing data with matplotlib and pandas for NICAR16,https://github.com/robroc/nicar16-visualizing-data-python,Jupyter Notebook,2016-01-18T06:45:17Z,2024-06-27T04:02:49Z,38,14,1,
302,minitarea2,astrodatos,Minitarea 1: Numpy y Matplotlib,https://github.com/astrodatos/minitarea2,Jupyter Notebook,2019-03-19T15:48:10Z,2019-03-29T15:43:04Z,0,24,0,
303,matplotvideo,PySport,Attach video player to matplotlib plot,https://github.com/PySport/matplotvideo,Python,2020-05-06T20:23:22Z,2024-09-28T13:18:24Z,41,6,6,MIT License
304,apa.mplstyle,sollan,Making APA style plots with matplotlib,https://github.com/sollan/apa.mplstyle,,2021-01-04T20:14:11Z,2024-05-30T02:08:17Z,16,9,0,GNU General Public License v3.0
305,-Mastering-Matplotlib-3,PacktPublishing, Mastering Matplotlib 3 by Packt Publishing,https://github.com/PacktPublishing/-Mastering-Matplotlib-3,Jupyter Notebook,2019-03-19T05:50:20Z,2021-11-08T13:10:49Z,9,10,0,MIT License
306,sorting-visualizer-matplotlib,lucs123,Scripts to visualize sorting algorithms using matplotlib animations,https://github.com/lucs123/sorting-visualizer-matplotlib,Python,2020-02-10T23:00:11Z,2023-05-16T21:32:19Z,33,4,0,MIT License
307,Math-for-Programmers-zh,Zijun-Yin,用python学透线性代数和微积分,https://github.com/Zijun-Yin/Math-for-Programmers-zh,Jupyter Notebook,2022-01-01T08:22:46Z,2024-10-03T04:43:05Z,68,22,0,
308,machine-learning,abulbasar,notebooks with example for machine learning examples,https://github.com/abulbasar/machine-learning,Jupyter Notebook,2017-05-05T18:09:09Z,2024-08-30T01:28:49Z,60,97,1,Apache License 2.0
309,matplotlib-xkcdify,JohannesBuchner,"sketchy, imprecise plotting theme for matplotlib",https://github.com/JohannesBuchner/matplotlib-xkcdify,Python,2012-11-03T23:54:33Z,2019-11-07T11:37:33Z,23,4,0,Other
310,mpl-modest-image,ChrisBeaumont,Friendlier matplotlib interaction with large images,https://github.com/ChrisBeaumont/mpl-modest-image,Python,2012-07-25T21:39:56Z,2021-09-15T00:19:23Z,15,9,6,Other
311,lab-matplotlib-seaborn,Ironhack-data-bcn-oct-2022,,https://github.com/Ironhack-data-bcn-oct-2022/lab-matplotlib-seaborn,Jupyter Notebook,2022-09-27T13:39:17Z,2022-09-27T13:39:40Z,0,18,17,
312,Matplotlib-real-time-viz,Thiagobc23,Examples of real-time data visualization with Matplotlib's FuncAnimation,https://github.com/Thiagobc23/Matplotlib-real-time-viz,Python,2021-01-23T19:38:04Z,2024-10-04T16:31:08Z,17,6,1,
313,roipoly.py,jdoepfert,"Select a polygonal region of interest (ROI) with python and matplotlib, similar to the roipoly.m function from MATLAB.",https://github.com/jdoepfert/roipoly.py,Python,2014-06-17T15:23:37Z,2024-06-25T10:52:54Z,127,46,9,Apache License 2.0
314,GooPyCharts,Dfenestrator,"A Google Charts API for Python, meant to be used as an alternative to matplotlib.",https://github.com/Dfenestrator/GooPyCharts,Python,2016-04-21T06:28:34Z,2024-08-05T19:10:02Z,205,17,5,Apache License 2.0
315,etframes,ahupp,"Edward Tufte's ideas, applied to matplotlib",https://github.com/ahupp/etframes,Python,2010-04-01T06:29:17Z,2024-03-12T04:54:53Z,57,7,0,
316,dsc-more-practice-with-matplotlib-online-ds-sp-000,learn-co-students,,https://github.com/learn-co-students/dsc-more-practice-with-matplotlib-online-ds-sp-000,Jupyter Notebook,2019-07-10T03:12:34Z,2019-10-21T14:01:44Z,0,40,0,Other
317,Python-3.0-Course,RaminSaljoughinejad,Python 3.x - Numpy - Matplotlib - Pandas - MySQL - etc.,https://github.com/RaminSaljoughinejad/Python-3.0-Course,Jupyter Notebook,2019-04-01T07:13:18Z,2024-08-08T14:36:06Z,34,9,0,
318,pyplotz,songlinhou,A light weight wrapper for matplotlib users with Chinese characters supported,https://github.com/songlinhou/pyplotz,Jupyter Notebook,2017-11-16T12:31:18Z,2023-10-20T07:39:52Z,62,10,3,MIT License
319,yellowbrick,DistrictDataLabs,Visual analysis and diagnostic tools to facilitate machine learning model selection.,https://github.com/DistrictDataLabs/yellowbrick,Python,2016-05-18T14:12:17Z,2024-10-04T07:05:31Z,4276,557,98,Apache License 2.0
320,pyDataScienceToolkits_Base,jasonding1354,使用Python进行数据分析实验工具NumPy、Pandas、Matplotlib、Scikit-learn的入门介绍，使用IPython Notebook格式,https://github.com/jasonding1354/pyDataScienceToolkits_Base,Python,2015-05-11T01:59:40Z,2024-10-02T01:50:28Z,371,188,1,MIT License
321,lab_matplotlib_seaborn,Ironhack-Data-Madrid-Abril-2021,,https://github.com/Ironhack-Data-Madrid-Abril-2021/lab_matplotlib_seaborn,Jupyter Notebook,2021-05-18T10:43:34Z,2021-05-18T10:48:10Z,0,17,1,
322,Bitcoin-Crypto-python-charts,Whalepool,Bitcoin & Crypto python charts with matplotlib,https://github.com/Whalepool/Bitcoin-Crypto-python-charts,Python,2017-05-23T18:56:32Z,2024-01-23T16:47:51Z,33,6,0,
323,5.2-lab_matplotlib_seaborn,Ironhack-Data-Madrid-Abril-2023,,https://github.com/Ironhack-Data-Madrid-Abril-2023/5.2-lab_matplotlib_seaborn,Jupyter Notebook,2023-04-11T15:18:53Z,2023-05-25T10:46:31Z,0,21,2,
324,PyGameofLife,robertmartin8,Conway's Game of Life using python's matplotlib and numpy,https://github.com/robertmartin8/PyGameofLife,Python,2017-06-22T12:15:53Z,2024-09-21T07:31:18Z,43,14,1,MIT License
325,hsf-training-matplotlib,hsf-training,Create commonly used plots in HEP with matplotlib and mplhep,https://github.com/hsf-training/hsf-training-matplotlib,Makefile,2020-12-18T15:25:39Z,2024-08-26T19:39:25Z,4,9,16,Other
326,5.2-lab-matplotlib-seaborn,Ironhack-Data-Madrid-Agosto-2022,,https://github.com/Ironhack-Data-Madrid-Agosto-2022/5.2-lab-matplotlib-seaborn,Jupyter Notebook,2022-09-06T09:58:52Z,2022-09-06T10:00:32Z,0,22,0,
327,Data-Science-and-Machine-Learning-Projects-Dojo,ptyadana,"collections of data science, machine learning and data visualization projects with pandas, sklearn, matplotlib, tensorflow2, Keras, various ML algorithms like random forest classifier, boosting, etc",https://github.com/ptyadana/Data-Science-and-Machine-Learning-Projects-Dojo,Jupyter Notebook,2020-03-18T14:02:03Z,2024-10-03T09:53:38Z,323,86,0,MIT License
328,5.2-lab-matplotlib-seaborn,Ironhack-Data-Madrid-Octubre-2022,,https://github.com/Ironhack-Data-Madrid-Octubre-2022/5.2-lab-matplotlib-seaborn,Jupyter Notebook,2022-11-14T10:45:55Z,2022-11-15T11:27:24Z,0,22,0,
329,Rpyplot,mpastell,R interface to matplotlib,https://github.com/mpastell/Rpyplot,R,2015-03-31T20:19:42Z,2021-08-07T04:35:57Z,13,6,2,
330,eyediagram,WarrenWeckesser,Tools for plotting an eye diagram in Python.,https://github.com/WarrenWeckesser/eyediagram,Python,2015-03-20T16:22:27Z,2024-08-08T05:42:43Z,46,23,2,"BSD 2-Clause ""Simplified"" License"
331,dsc-1-03-13-customizing-visualizations-with-matplotlib-lab-online-ds-sp-000,learn-co-students,,https://github.com/learn-co-students/dsc-1-03-13-customizing-visualizations-with-matplotlib-lab-online-ds-sp-000,Jupyter Notebook,2018-10-09T14:41:19Z,2019-01-17T18:05:22Z,0,65,4,Other
332,obj2png,pclausen,Python script for converting 3D triangular mesh (obj) to image file (png) with MatPlotLib,https://github.com/pclausen/obj2png,Python,2018-07-07T15:16:45Z,2024-05-04T09:26:19Z,62,20,1,MIT License
333,tkinter-matplotlib-dashboard,codefirstio,Source code for Youtube video: https://youtu.be/2JjQIh-sgHU,https://github.com/codefirstio/tkinter-matplotlib-dashboard,Python,2023-03-29T07:09:58Z,2024-09-02T07:56:42Z,14,5,0,
334,heart,susam,Hearts drawn with Python Matplotlib and C,https://github.com/susam/heart,Python,2014-06-20T06:55:28Z,2024-03-04T08:21:30Z,43,6,1,MIT License
335,NH19-Visualization,KirstieJane,A collection of notebooks demonstrating plotting with matplotlib,https://github.com/KirstieJane/NH19-Visualization,Jupyter Notebook,2019-07-29T00:13:04Z,2023-08-28T20:50:58Z,8,15,1,MIT License
336,GrasshopperMatplotlibGradients,timonielsen,Adds the matplotlib gradients to your grasshopper gradient component,https://github.com/timonielsen/GrasshopperMatplotlibGradients,Jupyter Notebook,2022-08-03T21:15:37Z,2024-08-17T01:40:50Z,23,4,0,MIT License
337,camera-models,mnslarcher,Simple camera models with NumPy and Matplotlib,https://github.com/mnslarcher/camera-models,Jupyter Notebook,2021-03-14T13:42:00Z,2024-04-18T07:46:07Z,30,8,0,MIT License
338,mpl-altair,matplotlib,Matplotlib Backend for Altair Visualization Library,https://github.com/matplotlib/mpl-altair,Python,2018-06-13T19:53:25Z,2024-09-01T13:54:27Z,14,8,22,Other
339,easyplot,HamsterHuey,"Easy Plot - A thin matplotlib wrapper for generating fast, easy and reusable plots in Python",https://github.com/HamsterHuey/easyplot,Python,2014-05-14T11:55:48Z,2024-07-28T02:34:42Z,167,15,8,MIT License
340,RCDS-plotting-in-python-with-matplotlib,ImperialCollegeLondon,,https://github.com/ImperialCollegeLondon/RCDS-plotting-in-python-with-matplotlib,Jupyter Notebook,2021-04-29T08:29:45Z,2024-09-24T06:50:06Z,9,9,0,
341,Matplotlib-and-Seaborn,liang-jacky,Matplotlib、Seaborn数据可视化教程和对应的例题，可以帮助提高数据可视化能力,https://github.com/liang-jacky/Matplotlib-and-Seaborn,Jupyter Notebook,2019-02-25T06:29:07Z,2024-07-30T15:15:02Z,22,4,0,
342,weekplot,utkuufuk,Visualize your weekly schedule,https://github.com/utkuufuk/weekplot,Python,2019-01-05T20:31:23Z,2024-09-24T17:52:06Z,49,9,2,MIT License
343,5.2-lab-matplotlib-seaborn,Ironhack-Data-Madrid-Enero-2023,,https://github.com/Ironhack-Data-Madrid-Enero-2023/5.2-lab-matplotlib-seaborn,Jupyter Notebook,2023-02-14T08:58:26Z,2023-02-14T12:56:01Z,0,20,0,
344,timeit_plot,cseager,Explore Python timeit output with matplotlib. ,https://github.com/cseager/timeit_plot,Python,2013-01-14T22:44:02Z,2024-05-31T07:21:48Z,36,5,1,
345,flask-matplotlib,realpython,render matplotlib images in flask (sample),https://github.com/realpython/flask-matplotlib,Python,2015-05-11T14:58:20Z,2024-04-22T08:50:31Z,9,5,0,
346,colorcet,holoviz,A set of useful perceptually uniform colormaps for plotting scientific data,https://github.com/holoviz/colorcet,Python,2016-11-07T03:30:57Z,2024-09-28T08:16:38Z,682,52,2,Other
347,Data-Analytics-Projects,CICIFLY,"This repository contains the projects related to data collecting, assessing,cleaning,visualizations and analyzing",https://github.com/CICIFLY/Data-Analytics-Projects,Jupyter Notebook,2018-11-19T23:50:52Z,2024-10-05T16:15:30Z,323,141,2,
348,matplotlib-workshop,UCL-DSS,,https://github.com/UCL-DSS/matplotlib-workshop,Jupyter Notebook,2020-10-01T05:42:27Z,2022-08-25T08:37:32Z,9,5,0,
349,subplot,ssumitshukla,Plotting multiple subplots using Matplotlib and Seaborn,https://github.com/ssumitshukla/subplot,Jupyter Notebook,2020-08-06T10:20:53Z,2024-09-04T00:20:09Z,9,10,0,
350,FIFA-2018-World-cup-predictions,itsmuriuki,"I used Machine Learning to make a Logistic Regression model using scikit-learn, pandas, numpy, seaborn and matplotlib to predict the results of FIFA 2018 World Cup.",https://github.com/itsmuriuki/FIFA-2018-World-cup-predictions,Jupyter Notebook,2018-06-07T12:34:12Z,2024-08-15T12:54:50Z,164,132,2,
351,PythonDataScience,xiaoyusmd,Python数据科学系专栏（pandas、Numpy、SKlearn、Matplotlib）、实战项目（代码、讲解、数据集）,https://github.com/xiaoyusmd/PythonDataScience,,2021-01-17T14:12:14Z,2024-07-07T14:29:16Z,211,55,0,MIT License
352,atlas-mpl,beojan,ATLAS style for matplotlib,https://github.com/beojan/atlas-mpl,Python,2017-12-08T14:36:38Z,2024-06-28T22:25:28Z,14,5,1,GNU General Public License v3.0
353,matplotlib_tutorial,mertalabas,Matplotlib Tutorial Library,https://github.com/mertalabas/matplotlib_tutorial,Jupyter Notebook,2019-08-30T09:31:13Z,2024-08-12T19:52:31Z,14,4,0,
354,PyWaffle,gyli,🧇 Make Waffle Charts in Python.,https://github.com/gyli/PyWaffle,Python,2017-11-14T20:03:47Z,2024-09-18T16:08:09Z,580,105,6,MIT License
355,Matplotlib-Lab3,Rana-Alhababi,,https://github.com/Rana-Alhababi/Matplotlib-Lab3,Jupyter Notebook,2023-10-31T16:22:54Z,2023-11-01T11:21:32Z,0,14,0,
356,dsc-0-03-131-customizing-matplotlib-online-ds-sp-000,learn-co-students,,https://github.com/learn-co-students/dsc-0-03-131-customizing-matplotlib-online-ds-sp-000,Jupyter Notebook,2018-10-03T19:29:05Z,2018-10-03T19:29:11Z,0,37,1,Other
357,mpl_tutorial,jakevdp,A basic Matplotlib tutorial,https://github.com/jakevdp/mpl_tutorial,Python,2012-10-25T12:27:09Z,2021-08-29T06:06:18Z,9,6,0,
358,Matplotlib-Lab1,KhawlahHad,,https://github.com/KhawlahHad/Matplotlib-Lab1,Jupyter Notebook,2023-10-31T14:57:18Z,2023-10-31T16:33:01Z,0,14,0,
359,pyoncoprint,pnucolab,Python OncoPrint library based on Matplotlib,https://github.com/pnucolab/pyoncoprint,Jupyter Notebook,2020-02-13T13:34:06Z,2024-09-10T15:46:35Z,21,6,4,"BSD 2-Clause ""Simplified"" License"
360,Python-for-Data-Science,chaklam-silpasuwanchai,"This is the repository for the course Python for Data Science covering Python Basics, Data Science Libraries (e.g., Pandas, Matplotlib, Sklearn).",https://github.com/chaklam-silpasuwanchai/Python-for-Data-Science,Jupyter Notebook,2020-05-21T03:13:12Z,2024-08-24T13:18:09Z,61,74,0,
361,talib-macd-example,mellertson,An example of using TA-lib to render a MACD indicator using matplotlib in Python,https://github.com/mellertson/talib-macd-example,Python,2017-06-08T02:11:39Z,2024-05-08T23:57:36Z,37,25,2,
362,Matplotlib-Lab2,KhawlahHad,,https://github.com/KhawlahHad/Matplotlib-Lab2,Jupyter Notebook,2023-10-31T14:57:24Z,2023-10-31T17:10:52Z,0,14,0,
363,Data-Science-in-Python-Pandas-Scikit-learn-Numpy-Matplotlib,jimit105,,https://github.com/jimit105/Data-Science-in-Python-Pandas-Scikit-learn-Numpy-Matplotlib,Jupyter Notebook,2017-12-28T10:33:40Z,2022-12-07T17:51:27Z,9,14,0,MIT License
